#CODE;ENGLISH;FRENCH;GERMAN;;SPANISH;;;;;;;;;x

CONSIDER_RELIGION_CHANGE;Consider converting to the beliefs of your [Root.Culture.GetName] ancestors;;;;;;;;;;;;;x
PURSUE_PAGAN_KNOWLEDGE;Begin the pursuit of ancient pagan knowledge, no matter the consequences\n;;;;;;;;;;;;;x
RECEIVED_INSTRUCTION_MYSTIC;Has received instruction on the ancient religion from a mystic\n;;;;;;;;;;;;;x
COMPLETELY_CONTROLS_GERMANIA_REGION;Completely controls the §YGermania Region§!\n;;;;;;;;;;;;;x
COMPLETELY_CONTROLS_ITALIA_REGION;Completely controls the §YItalia Region§!\n;;;;;;;;;;;;;x