#CODE;ENGLISH;FRENCH;GERMAN;;SPANISH;;;;;;;;;x

EVTDESC_Plus_1350;I have been gearing up for this confrontation for some time now. I have gained an audience, and will ask my father to recognize me.;;Ich bereite mich schon seit einiger Zeit auf diese Konfrontation vor. Ich habe eine Audienz bekommen und werde meinen Vater bitten, mich anzuerkennen.;;;;;;;;;;;x
EVTOPTA_Plus_1350;It's now or never...;;Jetzt oder nie...;;;;;;;;;;;x
EVTDESC_Plus_1351;It was rather unexpected when [From.GetTitledFirstName] asked for an audience, but when [From.GetSheHe] arrived [From.GetSheHe] explained that [From.GetSheHe] is a fully-grown [From.GetManWoman]...one that [From.GetSheHe] hopes is worthy of being considered your legitimate [GetFromRelation].;;Es war ziemlich unerwartet, als [From.GetTitledFirstName] um eine Audienz bat, aber als [From.GetSheHe] eintraf, erklärte [From.GetSheHe], dass [From.GetSheHe] eine ausgewachsene [From.GetManWoman] ist ... eine, von der [From.GetSheHe] hofft, dass sie es wert ist, als Eure rechtmäßige [GetFromRelation] betrachtet zu werden.;;;;;;;;;;;x
EVTOPTA_Plus_1351;That is not going to happen;;Das wird nicht passieren;;;;;;;;;;;x
EVTOPTB_Plus_1351;Convince [From.GetHerHim] why this cannot be;;Überzeugen Sie [From.GetHerHim], warum das nicht sein kann;;;;;;;;;;;x
EVTOPTC_Plus_1351;Refuse, but buy [From.GetHerHim] an estate;;Ablehnen, aber [From.GetHerHim] ein Anwesen kaufen;;;;;;;;;;;x
EVTOPTD_Plus_1351;Legitimize [From.GetHerHim];;Legitimieren Sie [From.GetHerHim];;;;;;;;;;;x
EVTDESC_Plus_1352;[From.GetTitledFirstName] shook his head. 'No,' he said. 'That is simply never going to happen. Put it out of your head.' Then he had me escorted from the court.;;[From.GetTitledFirstName] schüttelte den Kopf. 'Nein', sagte er. Das wird einfach nicht passieren. Schlag es dir aus dem Kopf.' Dann ließ er mich aus dem Hof eskortieren.;;;;;;;;;;;x
EVTOPTA_Plus_1352;So be it;;So sei es;;;;;;;;;;;x
EVTOPTB_Plus_1352;This isn't right!;;Das ist nicht richtig!;;;;;;;;;;;x
EVTDESC_Plus_1353;[From.GetTitledFirstName] listened to me for some time, and then he sat me down and we talked at length. He explained the political realities in [From.PrimaryTitle.GetName], and why legitimizing me would complicate things. I'm disappointed, but I do see the truth in his words.;;[From.GetTitledFirstName] hörte mir eine Weile zu, dann setzte er sich mit mir zusammen und wir unterhielten uns ausführlich. Er erklärte mir die politischen Gegebenheiten in [From.PrimaryTitle.GetName] und warum meine Legitimierung die Dinge verkomplizieren würde. Ich bin enttäuscht, aber ich sehe auch die Wahrheit in seinen Worten.;;;;;;;;;;;x
EVTDESC_Plus_1354;[From.GetTitledFirstName] listened to my plea for some time. While he ultimately did refuse to legitimize me, he offered me an estate off of which to live. It will make me a [Root.GetLordLady] of [From.PrimaryTitle.GetName], but is that enough?;;[From.GetTitledFirstName] hat sich mein Bittgesuch eine Zeit lang angehört. Er hat sich zwar letztendlich geweigert, mich zu legitimieren, aber er hat mir ein Anwesen angeboten, von dem ich leben kann. Das macht mich zu einer [Root.GetLordLady] von [From.PrimaryTitle.GetName], aber ist das genug?;;;;;;;;;;;x
EVTOPTB_Plus_1354;No, it's not enough!;;Nein, es ist nicht genug!;;;;;;;;;;;x
EVTDESC_Plus_1355;'Know that I, [From.GetTitledName], hereby consider [Root.GetTitledFirstName] to be my legitimate child and to be considered such throughout [From.PrimaryTitle.GetName]. [Root.GetSheHeCap] will take [Root.GetHerHis] rightful place within the [From.GetOnlyDynastyName] dynasty and among my heirs. By the grace of [From.Religion.GetRandomGodName] shall this be so.';;Wisse, dass ich, [From.GetTitledFirstName], hiermit [Root.GetTitledFirstName] als mein rechtmäßiges Kind betrachte und als solches im gesamten [From.PrimaryTitle.GetName] betrachtet werde. [Root.GetSheHeCap] wird [Root.GetHerHis] rechtmäßigen Platz innerhalb der [From.GetOnlyDynastyName] Dynastie und unter meinen Erben einnehmen. Durch die Gnade von [From.Religion.GetRandomGodName] soll dies so sein.';;;;;;;;;;;x
EVTDESC_Plus_1361;[From.GetTitledFirstName] has inherited the [FromFrom.GetFullName], a title that should rightfully belong to me. I have the feeling that many of [From.GetHerHis] vassals would agree. Perhaps I should make my case to them?;;[From.GetTitledFirstName] hat den [FromFrom.GetFullName] geerbt, einen Titel, der rechtmäßig mir gehören sollte. Ich habe das Gefühl, dass viele von [From.GetHerHis] Vasallen dem zustimmen würden. Vielleicht sollte ich meinen Fall bei ihnen vortragen?;;;;;;;;;;;x
EVTOPTA_Plus_1361;[FromFrom.GetName] is rightfully mine!;;[FromFrom.GetName] gehört rechtmäßig mir!;;;;;;;;;;;x
EVTOPTB_Plus_1361;No, let [From.GetTitledFirstName] have it;;Nein, überlasst [From.GetTitledFirstName] die Sache;;;;;;;;;;;x
EVTDESC_Plus_1362;Word reaches you that your [GetFromRelation], [From.GetTitledFirstName], has made a claim against your titles. [From.GetSheHeCap] is trying to win the support of your vassals, and it's possible some of them might actually agree with [From.GetHerHis] cause.;;Euch erreicht die Nachricht, dass Euer [GetFromRelation], [From.GetTitledFirstName], Anspruch auf Eure Titel erhoben hat. [From.GetSheHeCap] versucht, die Unterstützung Eurer Vasallen zu gewinnen, und es ist möglich, dass einige von ihnen tatsächlich mit [From.GetHerHis] einverstanden sind.;;;;;;;;;;;x
EVTOPTA_Plus_1362;Damn [From.GetHerHim]!;;Verdammt sei [From.GetHerHim]!;;;;;;;;;;;x
EVTOPTB_Plus_1362;Throw [From.GetHerHim] in prison at once;;Werft [From.GetHerHim] sofort ins Gefängnis;;;;;;;;;;;x
EVTDESC_Plus_1363;Word reaches you that [FromFrom.GetTitledFirstName] has made a claim against [From.GetTitledFirstName], claiming [FromFrom.GetSheHe] should rightfully have been the heir to the [From.PrimaryTitle.GetFullName]. It is not uncommon for bastards to do this, and you suspect there are some who might agree with [FromFrom.GetHerHis] cause.;;Euch erreicht die Nachricht, dass [From.GetTitledFirstName] Anspruch auf [From.GetTitledFirstName] erhebt und behauptet, dass [From.GetSheHe] rechtmäßig der Erbe des [From.PrimaryTitle.GetFullName] sein sollte. Es ist nicht ungewöhnlich, dass Bastarde dies tun, und Sie vermuten, dass es einige gibt, die der Sache von [From.GetHerHis] zustimmen könnten.;;;;;;;;;;;x
EVTOPTA_Plus_1363;I agree--[FromFrom.GetSheHe] should rule;;Ich stimme zu - [FromFrom.GetSheHe] sollte regieren;;;;;;;;;;;x
EVTOPTB_Plus_1363;No, I support [From.GetTitledName];;Nein, ich unterstütze [From.GetTitledName];;;;;;;;;;;x
EVTDESC_Plus_1370;Recently, you discovered that [Root.Father.GetTitledFirstName] was never your father at all. Should you confront your real father and demand the truth?;;Vor kurzem hast du herausgefunden, dass [Root.Father.GetTitledFirstName] gar nicht dein Vater war. Sollten Sie Ihren echten Vater zur Rede stellen und die Wahrheit verlangen?;;;;;;;;;;;x
EVTOPTA_Plus_1370;I need to know the truth;;Ich muss die Wahrheit wissen;;;;;;;;;;;x
EVTOPTB_Plus_1370;I am a [Root.GetOnlyDynastyName], and that's all that matters;;Ich bin ein [Root.GetOnlyDynastyName], und das ist alles, was zählt;;;;;;;;;;;x
EVTDESC_Plus_1371;[From.GetTitledFirstName] recently came to me, saying that [From.GetSheHe] recently learned that [From.Father.GetTitledFirstName] was not, in fact, [From.GetHerHis] real father. In fact, [From.GetSheHe] believes I am. It's true, of course, but now [From.GetSheHe] expects an answer...;;[From.GetTitledFirstName] kam vor kurzem zu mir und sagte, dass [From.GetSheHe] vor kurzem erfahren hat, dass [From.Father.GetTitledFirstName] in Wirklichkeit nicht [From.GetHerHis] echter Vater ist. In Wirklichkeit glaubt [From.GetSheHe], dass ich es bin. Das ist natürlich wahr, aber jetzt erwartet [From.GetSheHe] eine Antwort...;;;;;;;;;;;x
EVTOPTA_Plus_1371;Tell [From.GetHerHim] the truth;;Sagt [From.GetHerHim] die Wahrheit;;;;;;;;;;;x
EVTOPTB_Plus_1371;Deny it;;Leugne es;;;;;;;;;;;x
EVTOPTC_Plus_1371;Convince [From.GetHerHim] it's not true;;Überzeugen Sie [From.GetHerHim], dass es nicht wahr ist;;;;;;;;;;;x
EVTDESC_Plus_1372;[From.GetTitledFirstName] sighed heavily when I confronted him, but eventually nodded. 'I can't be certain,' he admitted, 'but I was close to your mother once, and you were born during that time. You are my child.';;"[From.GetTitledFirstName] seufzte schwer, als ich ihn damit konfrontierte, nickte aber schließlich. Ich kann es nicht mit Sicherheit sagen"", gab er zu, ""aber ich stand deiner Mutter einst sehr nahe, und du wurdest in dieser Zeit geboren. Du bist mein Kind.'";;;;;;;;;;;x
EVTOPTA_Plus_1372;Then I want to be recognized as such;;Dann will ich auch als solches anerkannt werden.;;;;;;;;;;;x
EVTOPTB_Plus_1372;That's all I wanted to know;;Das ist alles, was ich wissen wollte.;;;;;;;;;;;x
EVTDESC_Plus_1373;I asked [From.GetTitledFirstName] for the truth, and he looked me straight in the eye and said he wasn't my father. It's not true, of course, but obviously he will lie to my face about it.;;Ich fragte [From.GetTitledFirstName] nach der Wahrheit, und er sah mir direkt in die Augen und sagte, er sei nicht mein Vater. Das ist natürlich nicht wahr, aber natürlich wird er mir ins Gesicht lügen.;;;;;;;;;;;x
EVTOPTA_Plus_1373;So be it;;So sei es;;;;;;;;;;;x
EVTDESC_Plus_1374;[From.GetTitledFirstName] appeared genuinely confused when I confronted him. 'I knew your mother once, it's true,' he admitted, 'but that's all. [Root.Father.GetTitledFirstName] is surely your father. You even have his look about you.' I felt embarrassed to have even brought it up.;;"[From.GetTitledFirstName] wirkte aufrichtig verwirrt, als ich ihn zur Rede stellte. Ich kannte deine Mutter einmal, das ist wahr"", gab er zu, ""aber das ist alles. [Root.Father.GetTitledFirstName] ist sicherlich Ihr Vater. Du hast sogar sein Aussehen.' Es war mir peinlich, es überhaupt erwähnt zu haben.";;;;;;;;;;;x
EVTOPTA_Plus_1374;I suppose I was mistaken;;Wahrscheinlich habe ich mich geirrt.;;;;;;;;;;;x
EVTDESC_Plus_1375;To my surprise, [From.GetTitledFirstName] merely nodded and turned to leave after I told [From.GetHerHim] the truth. 'I only wanted to hear it from your own lips,' [From.GetSheHe] said. I wonder if this is the last I will hear of it?;;"Zu meiner Überraschung nickte [From.GetTitledFirstName] nur und wandte sich zum Gehen, nachdem ich [From.GetHerHim] die Wahrheit gesagt hatte. Ich wollte es nur aus deinem Munde hören"", sagte [From.GetSheHe]. Ich frage mich, ob dies das letzte Mal ist, dass ich davon höre?";;;;;;;;;;;x
EVTDESC_Plus_1376;[From.GetTitledFirstName] nodded when I told [From.GetHerHim] the truth. 'Then recognize me. If I am truly your kin, I want to be known as such. I have rights, do I not?';;[From.GetTitledFirstName] nickte, als ich [From.GetHerHim] die Wahrheit sagte. Dann erkennt mich an. Wenn ich wirklich mit Euch verwandt bin, möchte ich auch als solcher erkannt werden. Ich habe doch Rechte, nicht wahr?';;;;;;;;;;;x

ask_him_the_truth;Ask §Y[This.GetBestName]§! if he is your real father;;Frage §Y[This.GetBestName]§! ob er dein echter Vater ist;;;;;;;;;;;x
ask_to_be_recognized;Ask to be recognized as his legitimate child;;Bitte darum, als sein rechtmäßiges Kind anerkannt zu werden;;;;;;;;;;;x
buy_off_with_estate;Give [From.GetTitledFirstName] an estate off of which to live;;Gib [From.GetTitledFirstName] ein Vermögen, von dem du leben kannst;;;;;;;;;;;x
legitimize_him;Declare [This.GetHerHim] your legitimate child;;Erkläre [This.GetHerHim] zu deinem rechtmäßigen Kind;;;;;;;;;;;x
