#CODE;ENGLISH;FRENCH;GERMAN;;SPANISH;;;;;;;;;x
EVTDESCLoR.17;The ancient region of Pontus is the latest addition to the ever-expanding domains of the Roman Empire.;;;;;;;;;;;;;x
EVTNAMELoR.18;The Province of Thracia;;;;;;;;;;;;;x
EVTDESCLoR.18;The ancient region of Thracia is the latest addition to the ever-expanding domains of the Roman Empire.;;;;;;;;;;;;;x
EVTDESCLoR.200;With the city under [Root.PrimaryTitle.GetAdjective] control, the Patriarchate of Antioch has been properly restored as one of the episcopal sees of the Pentarchy in the [Root.Religion.GetName] Church. It was originally founded by Saint Peter the Apostle, who is regarded as the first Pope by the Western Catholic Church.;;;;;;;;;;;;;x
EVTDESCLoR.201;With the city under [Root.PrimaryTitle.GetAdjective] control, the Patriarchate of Jerusalem has been properly restored as one of the episcopal sees of the Pentarchy in the [Root.Religion.GetName] Church. It was originally founded by Saint James the Just, who was made head of the Church in Jerusalem soon after the death of Jesus.;;;;;;;;;;;;;x
EVTDESCLoR.202;With the city under [Root.PrimaryTitle.GetAdjective] control, the Patriarchate of Alexandria has been properly restored as one of the episcopal sees of the Pentarchy in the [Root.Religion.GetName] Church. It was originally founded by Saint Mark the Evangelist, who became Alexandria's first patriarch.;;;;;;;;;;;;;x
EVTDESCLoR.203;With the city under [Root.PrimaryTitle.GetAdjective] control, the Patriarchate of Rome has been properly restored as one of the episcopal sees of the Pentarchy in the [Root.Religion.GetName] Church. If all five historical patriarchates are returned to the Pentarchy, it will be perhaps be possible for the Great Schism which has divided eastern and western Christianity to finally be mended.;;;;;;;;;;;;;x
EVTDESC_LoR_230;With the city now under [Root.PrimaryTitle.GetAdjective] control, the Patriarchate of Constantinople has been properly restored as one of the episcopal sees of the Pentarchy in the [Root.Religion.GetName] Church. If all five historical patriarchates are returned to the Pentarchy, it will be perhaps be possible for the Great Schism which has divided eastern and western Christianity to finally be mended.;;;;;;;;;;;;;x
EVTNAME_LoR_1200;The Province of Sicilia;;;;;;;;;;;;;x
EVTDESC_LoR_1200;Imperial rule over Sicilia, one of the last western outposts of the Empire to be lost to barbarian rule, has been reinstated yet again - this time hopefully for good.;;;;;;;;;;;;;x
EVTNAME_LoR_1201;The Province of Corsica et Sardinia;;;;;;;;;;;;;x
EVTDESC_LoR_1201;The islands of Corsica and Sardinia, originally incorporated in the empire after the First Punic War, are yet again under imperial rule. The conquest of this strategic location in the Mediterranian heralds a glorious westward expansion of the Empire.;;;;;;;;;;;;;x
EVTNAME_LoR_1202;The Province of Viennensis;;;;;;;;;;;;;x
EVTDESC_LoR_1202;Viennensis, named after the town Vienne in southeastern Gaul, has long been lost to Roman rule, but has now been incorporated back into the Empire. It was originally formed as a merger of the provinces Gallia Aquitania and Gallia Narbonensis created by Caesar after his campaigns had expanded the old province of Gaul too far to be administered as a single province.;;;;;;;;;;;;;x
EVTNAMELoR.100;The Province of Pannonia-Dacia;;;;;;;;;;;;;x
EVTDESCLoR.100;At the Empire's greatest extent, during the rule of Emperor Trajan, both Pannonia and Dacia were under Roman rule. Now, once again, these lands are back in the Empire, where they belong.;;;;;;;;;;;;;x
EVTNAMELoR.101;The Province of Armenia;;;;;;;;;;;;;x
EVTDESCLoR.101;At the Empire's greatest extent, during the rule of Emperor Trajan, Armenia was under Roman rule. Now, once again, this land is back in the Empire, where it belongs.;;;;;;;;;;;;;x
EVTDESC_Plus_100;I have decided to pardon [From.GetTitledName] of all [From.GetHerHis] crimes.;;;;;;;;;;;;;x
EVTOPTA_Plus_100;Mercy is a virtue;;;;;;;;;;;;;x
EVTOPTB_Plus_100;Eh, never mind;;;;;;;;;;;;;x
EVTDESC_Plus_105;I have decided to grant estates and land to [From.GetFullName], but how much land will [From.GetSheHe] receive?;;;;;;;;;;;;;x
EVTOPTA_Plus_105;A minor estate;;;;;;;;;;;;;x
EVTOPTB_Plus_105;A moderate estate;;;;;;;;;;;;;x
EVTOPTC_Plus_105;A large estate;;;;;;;;;;;;;x
EVTOPTD_Plus_105;None at all!;;;;;;;;;;;;;x
EVTDESC_Plus_107;Today, my [GetFromRelation] [From.GetFirstName] asked me for landed estates to live off...;;;;;;;;;;;;;x
EVTOPTA_Plus_107;I gave [From.GetHerHim] what [From.GetSheHe] wanted;;;;;;;;;;;;;x
EVTOPTB_Plus_107;I told [From.GetHerHim] I could not afford it...;;;;;;;;;;;;;x
EVTDESC_Plus_109;I have arranged for the sale of my old estates so that I can concentrate my wealth to the lands that I now hold.;;;;;;;;;;;;;x
EVTDESC_Plus_115;A claim on a title has been discovered!;;;;;;;;;;;;;x
EVTDESC_Plus_116;I have learned that [From.GetTitledName] has laid claim to one of my titles on the grounds of ancestral inheritance.;;;;;;;;;;;;;x
EVTOPTA_Plus_116;[From.GetSheHeCap] better not try anything!;;;;;;;;;;;;;x
EVTDESC_Plus_120;I have ruled long enough, and my health is no longer what it once was. Perhaps the time has come to pass my titles onto my heir?;;;;;;;;;;;;;x
EVTOPTA_Plus_120;Yes, it is time;;;;;;;;;;;;;x
EVTOPTB_Plus_120;No, not just yet;;;;;;;;;;;;;x
EVTDESC_Plus_121;[From.GetTitledName] has decided to voluntarily abdicate [From.GetHerHis] rule, citing poor health and other concerns. [From.GetHerHisCap] titles have been passed onto me.;;;;;;;;;;;;;x
EVTOPTA_Plus_121;[From.GetSheHeCap] will surely be missed;;;;;;;;;;;;;x
EVTDESC_Plus_126;Even though you have been trying to conceive a child with your husband, it simply hasn't happened... and you are beginning to suspect you might be barren. Some of the maids have whispered that there are things which can be done to remedy this, although they are not entirely without risk.;;;;;;;;;;;;;x
EVTOPTA_Plus_126;I don't care about the risk! I want a child!;;;;;;;;;;;;;x
EVTOPTB_Plus_126;I will put my faith in [Root.Religion.GetRandomGodName];;;;;;;;;;;;;x
EVTOPTC_Plus_126;[Root.Spouse.GetFirstName] will get no child from me;;;;;;;;;;;;;x
EVTDESC_Plus_127;For some time now, your councilors have made their suspicions known that [barren_wife.GetTitledFirstNameNoRegnal] is, in fact, barren. You've denied it, certain that the two of you would have a child before long... but perhaps they are right? Worse, you believe she knows the truth and has said nothing.;;;;;;;;;;;;;x
EVTOPTA_Plus_127;How could this have happened?;;;;;;;;;;;;;x
EVTDESC_Plus_130;The [Root.Liege.PrimaryTitle.GetFullName] is not a realm where all power is rooted in the [Root.Liege.PrimaryTitle.GetRulerTitle], and thus it does not seem right that [Root.Liege.GetSheHe] should hold so many crowns. Perhaps the [Root.Capital.Kingdom.GetFullName] needs a new ruler?;;;;;;;;;;;;;x
EVTOPTA_Plus_130;Demand [Root.Liege.GetSheHe] grant [Root.Capital.Kingdom.GetName] to me;;;;;;;;;;;;;x
EVTOPTB_Plus_130;[Root.Liege.GetSheHeCap] has enough problems, I'm certain;;;;;;;;;;;;;x
EVTDESC_Plus_131;The [Root.PrimaryTitle.GetFullName] is not a realm where all power resides in the hands of the [Root.PrimaryTitle.GetRulerTitle], and the consensus appears to be that I hold too many titles myself. Thus it is no surprise that [From.GetTitledFirstName] has demanded the crown of [From.Capital.Kingdom.GetName] be granted to [From.GetHerHim].;;;;;;;;;;;;;x
EVTOPTA_Plus_131;Give [From.GetHerHim] the crown;;;;;;;;;;;;;x
EVTOPTB_Plus_131;I will give it to one of my children instead;;;;;;;;;;;;;x
EVTOPTC_Plus_131;The crown will go to someone in line for the title;;;;;;;;;;;;;x
EVTOPTD_Plus_131;I will give it to someone with a claim;;;;;;;;;;;;;x
EVTOPTE_Plus_131;How dare [From.GetSheHe] even ask! The crown is mine!;;;;;;;;;;;;;x
EVTDESC_Plus_132;Dear [Root.GetTitledFirstName],\nKnow that I consider you even asking me to surrender the crown of [Root.Capital.Kingdom.GetName] to be impertinent. My titles are mine to keep, and I will kindly ask you to remember your place.\n\nSigned,\n[From.GetTitledName];;;;;;;;;;;;;x
EVTOPTA_Plus_132;Impertinent? How dare [From.GetSheHe]!;;;;;;;;;;;;;x
EVTDESC_Plus_133;Dear [Root.GetTitledFirstName],\nWhile your argument regarding the need for the crown of [Root.Capital.Kingdom.GetName] to not rest in my hands seems valid, know that I have decided to give it to another. I trust you will show them the same loyalty and consideration you have always shown me.\n\nSigned,\n[From.GetTitledName];;;;;;;;;;;;;x
EVTOPTA_Plus_133;The crown should have been mine;;;;;;;;;;;;;x
EVTDESC_Plus_135;[Root.Liege.GetTitledName] has declared an Antipope, [Root.RelHead.GetTitledName], in opposition to the true Pope. As a good [Root.Religion.GetName], I should consider whether I support [Root.Liege.GetTitledFirstName] in [Root.Liege.GetHerHis] actions, or whether I believe [Root.Liege.GetSheHe] has done nothing more than undermine the authority of the [Root.Religion.GetName] Church.;;;;;;;;;;;;;x
EVTOPTA_Plus_135;I support [Root.Liege.GetTitledFirstName];;;;;;;;;;;;;x
EVTOPTB_Plus_135;I support the true Pope;;;;;;;;;;;;;x
EVTOPTC_Plus_135;I don't care who the Pope is, to be perfectly frank;;;;;;;;;;;;;x
EVTDESC_Plus_140;[FromFrom.GetTitledName] has decided to set you aside. As of this moment, by the laws of the [FromFrom.Religion.GetName] faith, you are no longer married.;;;;;;;;;;;;;x
EVTOPTA_Plus_140;That bitch! How dare she!;;;;;;;;;;;;;x
EVTOPTB_Plus_140;That bastard! How dare he!;;;;;;;;;;;;;x
EVTDESC_Plus_141;News has reached you that [FromFromFrom.GetTitledName] has decided to set aside your [GetFromRelation], [From.GetTitledFirstNameNoRegnal]. According to the laws of the [FromFromFrom.Religion.GetName] faith, the two are no longer married.;;;;;;;;;;;;;x
EVTDESC_Plus_142;Your [GetFromRelation], [From.GetTitledFirstNameNoRegnal], has decided to establish a cadet branch of the [Root.GetOnlyDynastyName] dynasty. From now on, he and all his descendants will be known as the [From.GetOnlyDynastyName] dynasty.;;;;;;;;;;;;;x
EVTDESC_Plus_143;Your [GetFromRelation], [From.GetTitledFirstNameNoRegnal], has decided to establish a cadet branch of the [old_dynasty_head.GetOnlyDynastyName] dynasty. From now on, he and all his descendants will be known as the [From.GetOnlyDynastyName] dynasty.;;;;;;;;;;;;;x
EVTDESC_Plus_144;It is no longer enough for me to be a member of the [old_dynasty_head.GetOnlyDynastyName] dynasty. That legacy belongs to my elder brother, while I was expected for lesser things. Now that I am the [Root.PrimaryTitle.GetRulerTitle] of [Root.PrimaryTitle.GetName], it is time to establish a legacy in my own name. From now on, my descendants and I will be known as the [Root.GetOnlyDynastyName] dynasty!;;;;;;;;;;;;;x
EVTOPTA_Plus_144;My accomplishments will be my own;;;;;;;;;;;;;x
EVTDESC_Plus_145;The [old_dynasty_head.GetTitledFirstNameNoRegnal], the [old_dynasty_head.GetOnlyDynastyName] dynasty has become decadent, and Allah would not look favorably upon it. From now on, my descendants and I will be known as the [Root.GetOnlyDynastyName] dynasty, and we shall establish a new chapter in the [Root.PrimaryTitle.GetFullName]!;;;;;;;;;;;;;x
EVTDESC_Plus_146;The time has come to break away from my relatives in the [old_dynasty_head.GetOnlyDynastyName] dynasty. As the [Root.PrimaryTitle.GetRulerTitle] of [Root.PrimaryTitle.GetName], I hereby declare that my descendants shall be part of the [Root.GetOnlyDynastyName] dynasty!;;;;;;;;;;;;;x
EVTDESC_Plus_150_transit;Finally, an opportunity has arisen to abduct [Root.PlotTarget.GetTitledName] when [Root.PlotTarget.GetSheHe] takes a planned journey from [Root.PlotTarget.Location.GetName] to a nearby town. Shall I tell my co-conspirators to begin their preparations?;;;;;;;;;;;;;x
EVTDESC_Plus_150_bed;Finally, an opportunity to abduct [Root.PlotTarget.GetTitledName] has arisen. One of the [Root.PlotTarget.PrimaryTitle.GetRulerTitle]'s personal guard has proven amenable to bribery, allowing for the opportunity to take [Root.PlotTarget.GetHerHim] while [Root.PlotTarget.GetSheHe] sleeps. Shall I tell my co-conspirators to begin their preparations?;;;;;;;;;;;;;x
EVTDESC_Plus_150_hunting;Finally, an opportunity has arisen to abduct [Root.PlotTarget.GetTitledName] when [Root.PlotTarget.GetSheHe] goes on a planned hunting trip over a week from now. The perfect chance to catch [Root.PlotTarget.GetHerHim] away from court! Shall I tell my co-conspirators to begin their preparations?;;;;;;;;;;;;;x
EVTDESC_Plus_150_carouse;Finally, an opportunity to abduct [Root.PlotTarget.GetTitledName] has arisen. The [Root.PlotTarget.GetManWoman]'s amourous nature has betrayed [Root.PlotTarget.GetHerHim]--a planned trip to a brothel in [Root.PlotTarget.Location.GetName] will prove the perfect chance, if we move quickly. Shall I tell my co-conspirators to begin their preparations?;;;;;;;;;;;;;x
EVTOPTA_Plus_150;We must proceed with the plan!;;;;;;;;;;;;;x
EVTOPTB_Plus_150;Not yet, this is too risky;;;;;;;;;;;;;x
EVTDESC_Plus_151;At last, after having watched our target here in [Root.Location.GetName] for so long, an opportunity for abduction has arisen. I must tell the others at once!;;;;;;;;;;;;;x
EVTOPTA_Plus_151;With luck, this will be over soon;;;;;;;;;;;;;x
EVTDESC_Plus_152;My dear [Root.GetTitledFirstNameNoRegnal],\nIt seems the opportunity to abduct [From.PlotTarget.GetTitledFirstNameNoRegnal] is finally upon us. I ask that you stand ready to make your move. If we fail this chance, it will not come again quickly.\n\nMy thanks,\n[From.GetTitledName];;;;;;;;;;;;;x
EVTDESC_Plus_155;My co-conspirators send word that they have prepared everything we need to discredit [Root.PlotTarget.GetTitledFirstName]. Documents of [Root.PlotTarget.GetHerHis] corruption have been prepared, and courtiers have been bribed to whisper to [Root.Liege.GetTitledFirstName] of [Root.PlotTarget.GetHerHis]'s incompetence. With [Root.PlotTarget.GetHerHis] reputation in tatters, [Root.PlotTarget.GetTitledFirstName] will find it impossible to hold on to [Root.PlotTarget.GetHerHis] position on the council.;;;;;;;;;;;;;x
EVTOPTA_Plus_155;That position will be mine!;;;;;;;;;;;;;x
EVTDESC_Plus_156;I have found myself the target of a vicious campaign of slander at court. Rumors of incompetence and corruption have undermined the authority of my position, and it seems that even [Root.Liege.GetTitledName] have come to believe them as I have been removed from my position at the council.;;;;;;;;;;;;;x
EVTOPTA_Plus_156;I am ruined!;;;;;;;;;;;;;x
EVTDESC_Plus_157;The attempt to discredit [From.GetTitledFirstName] was a success! [Root.Liege.GetTitledFirstName] has dismissed [From.GetHerHim] from the council and [From.GetHerHis] position is now vacant and ready for me to occupy.;;;;;;;;;;;;;x
EVTOPTA_Plus_157;Excellent!;;;;;;;;;;;;;x
EVTDESC_Plus_158;Lately it seems that I have heard nothing but bad of [From.GetTitledFirstName], from whispers of incompetence at court to documents proving [From.GetHerHis] corruption slipped under my bedroom door at night. I refused to believe it at first, but in the end I could not deny the weight of the evidence and was forced to remove [From.GetTitledFirstName] from [From.GetHerHis] position at court.;;;;;;;;;;;;;x
EVTOPTA_Plus_158;It had to be done;;;;;;;;;;;;;x
EVTDESC_Plus_159;I have found myself the target of a vicious campaign of slander at court. Whispers of incompetence and accusations of corruption have been directed at me, but fortunately [Root.Liege.GetTitledFirstName] have refused to give them credence and ordered an investigation into the source of the rumors. Although the investigation turned up nothing, my position at court is secure.;;;;;;;;;;;;;x
EVTOPTA_Plus_159;Who could have instigated such an underhanded scheme?;;;;;;;;;;;;;x
EVTDESC_Plus_160;Despite the rumors and accusations directed at [From.GetTitledFirstName], [Root.Liege.GetTitledFirstName] refused to dismiss [From.GetHerHim] from the council and has ordered an investigation into the source of the rumors. Fortunately, the investigation turned up no evidence of my involvement.;;;;;;;;;;;;;x
EVTOPTA_Plus_160;It could have been worse...;;;;;;;;;;;;;x
EVTDESC_Plus_161;Lately it seems that I have heard nothing but bad of [From.GetTitledFirstName], from whispers of incompetence at court to documents proving [From.GetHerHis] corruption slipped under my bedroom door at night. I refused to believe the accusations, and ordered an investigation into the source of the rumors. A thorough questioning of the court turned up nothing, but has at least put a stop to the slanderous accusations.;;;;;;;;;;;;;x
EVTDESC_Plus_162;I have found myself the target of a vicious campaign of slander at court. Whispers of incompetence and accusations of corruption have been directed at me, but fortunately [Root.Liege.GetTitledFirstName] have refused to give them credence and ordered an investigation into their source which revealed the involvement [From.GetTitledName]...;;;;;;;;;;;;;x
EVTOPTA_Plus_162;[From.GetTitledFirstName] will pay for this!;;;;;;;;;;;;;x
EVTDESC_Plus_163;Despite the rumors and accusations directed at [From.GetTitledFirstName], [Root.Liege.GetTitledFirstName] refused to dismiss [From.GetHerHim] from the council. Even worse, [Root.Liege.GetFirstName] ordered an investigation into the source of the rumors, which turned up evidence of my involvement...;;;;;;;;;;;;;x
EVTOPTA_Plus_163;[Root.Liege.GetTitledFirstName] is not pleased...;;;;;;;;;;;;;x
EVTDESC_Plus_164;Lately it seems that I have heard nothing but bad of [From.GetTitledFirstName], from whispers of incompetence at court to documents proving [From.GetHerHis] corruption slipped under my bedroom door at night. I refused to believe the accusations and ordered an investigation of their source which revealed the involvement of [FromFrom.GetTitledName];;;;;;;;;;;;;x
EVTOPTA_Plus_164;[FromFrom.GetTitledFirstName] will pay for this!;;;;;;;;;;;;;x
EVTDESC_Plus_170;The tithes and taxes for [Root.Liege.GetTitledFirstName] are on their way to [Root.Liege.GetHerHis] castle and my co-conspirators have bribed the guards not to notice if a chest or two should go 'missing'. Everything is ready for the robbery to proceed.;;;;;;;;;;;;;x
EVTOPTA_Plus_170;We'll all be rich!;;;;;;;;;;;;;x
EVTDESC_Plus_171;The taxes and tithes due to me arrived at the castle today and were placed in the treasury. As I was inspecting the chests full of gold, it struck me that there seemed to be fewer of them than what had arrived earlier. A quick check of the treasurer's accounts revealed my worst fears...;;;;;;;;;;;;;x
EVTOPTA_Plus_171;I have been robbed!;;;;;;;;;;;;;x
EVTDESC_Plus_172;As the taxes were being hauled into the treasury, several large chests full of gold made their way onto the back of a wagon which left the castle unnoticed. The gold is now safely locked away in my treasury and my co-conspirators have all received their share.;;;;;;;;;;;;;x
EVTOPTA_Plus_172;Everything went as planned!;;;;;;;;;;;;;x
EVTDESC_Plus_173;I have received my share of the money embezzled by [From.GetTitledFirstName] from [From.Liege.GetTitledFirstName].;;;;;;;;;;;;;x
EVTDESC_Plus_174;The taxes and tithes due to me arrived at the castle today. As I was watching the money being carried into the treasury, I noticed some shadowy figures trying to make off with several chests full of gold. I had my guards seize them, and under questioning they revealed themselves to be in the employ of [From.GetTitledFirstName]. What shall be done with my thieving vassal?;;;;;;;;;;;;;x
EVTOPTA_Plus_174;Throw [From.GetTitledFirstName] in irons!;;;;;;;;;;;;;x
EVTOPTB_Plus_174;Off with [From.GetHerHis] head!;;;;;;;;;;;;;x
EVTOPTC_Plus_174;Forgive [From.GetHerHim];;;;;;;;;;;;;x
EVTDESC_Plus_175;As the taxes were being hauled into the treasury, my men tried to make off with several chests of gold but were spotted by [From.GetTitledFirstName], who had come out to inspect the process [From.GetHerHim]self. Under questioning they revealed to myself to be in my employ, and now [From.GetTitledFirstName] knows that I attempted to rob [From.GetHerHim].;;;;;;;;;;;;;x
EVTOPTA_Plus_175;Retribution is sure to come...;;;;;;;;;;;;;x
EVTDESC_Plus_180;My co-conspirators have fabricated evidence that [Root.PlotTarget.GetTitledFirstName] is planning a revolt against [Root.PlotTarget.Liege.GetHerHis] liege. The evidence will discreetly find its way into the hands of [Root.PlotTarget.Liege.GetTitledFirstName], who cannot fail to act on it.;;;;;;;;;;;;;x
EVTOPTA_Plus_180;I will see [Root.PlotTarget.GetHerHim] disgraced!;;;;;;;;;;;;;x
EVTDESC_Plus_181;Word has reached me that [Root.Liege.GetTitledFirstName] has publicly accused me of treason based on evidence found in some documents that were slipped under [Root.Liege.GetHerHis] bedroom door.;;;;;;;;;;;;;x
EVTOPTA_Plus_181;This must be a scheme to see me arrested!;;;;;;;;;;;;;x
EVTDESC_Plus_182;[From.Liege.GetTitledFirstName] was completely fooled by the fabricated evidence of [From.GetTitledFirstName]'s treason. It can only be a matter of time before [From.GetSheHe] is arrested.;;;;;;;;;;;;;x
EVTDESC_Plus_183;As I rose from bed, I found a small bundle of documents that had been slipped beneath my bedroom door. The documents contained evidence of [From.GetTitledFirstName]'s plans to depose me and seize the throne.;;;;;;;;;;;;;x
EVTOPTA_Plus_183;I must have [From.GetHerHim] arrested!;;;;;;;;;;;;;x
EVTDESC_Plus_184;As I rose from bed, I found a small bundle of documents that had been slipped beneath my bedroom door. The documents contained evidence of [From.GetTitledFirstName]'s plans to depose me and seize the throne.;;;;;;;;;;;;;x
EVTOPTA_Plus_184;I wonder who sent it...;;;;;;;;;;;;;x
EVTDESC_Plus_185;[From.Liege.GetTitledFirstName] refused to believe the fabricated evidence of [From.GetTitledFirstName]'s treason. Although the scheme has failed, at least there is no evidence of my involvement.;;;;;;;;;;;;;x
EVTDESC_Plus_186;As I rose from bed, I found a small bundle of documents that had been slipped beneath my bedroom door. The documents contained evidence of [From.GetTitledFirstName]'s plans to depose me and seize the throne.;;;;;;;;;;;;;x
EVTOPTA_Plus_186;Nothing but lies and slander;;;;;;;;;;;;;x
EVTDESC_Plus_187;[From.GetTitledFirstName] tried to have me arrested for treason by slipping fabricated 'evidence' under [Root.Liege.GetTitledFirstName]'s bedroom door, but fortunately [Root.Liege.GetSheHe] caught [From.GetHerHis] agent in the act and now it is [From.GetTitledFirstName] that stands accused of treason.;;;;;;;;;;;;;x
EVTOPTA_Plus_187;How dare [From.GetSheHe]!;;;;;;;;;;;;;x
EVTDESC_Plus_188;My agent was caught in the act of slipping the fabricated evidence under [From.Liege.GetTitledFirstName]'s bedroom door. Even worse, my involvement was revealed during questioning and now I am the one that stands accused of treason.;;;;;;;;;;;;;x
EVTOPTA_Plus_188;This is bad!;;;;;;;;;;;;;x
EVTDESC_Plus_189;As I was getting ready to sleep, I heard a scuffle from outside my bedroom door. Rushing outside, I found that my guards had seized a cloaked man as he was attempting to slip some documents into the room. Under questioning, he revealed that he was working for [FromFrom.GetTitledFirstName] and that the documents were fabricated evidence intended to turn me against my vassal [From.GetTitledFirstName].;;;;;;;;;;;;;x
EVTOPTA_Plus_189;[FromFrom.GetTitledFirstName] is the true traitor!;;;;;;;;;;;;;x
EVTDESC_Plus_195;My co-conspirators have fabricated evidence of [Root.PlotTarget.GetTitledFirstName]'s blasphemous conduct and sheltering of heretics. The letter will be sent to [Root.PlotTarget.RelHead.GetTitledFirstName] who will be forced to excommunicate [Root.PlotTarget.GetHerHim].;;;;;;;;;;;;;x
EVTOPTA_Plus_195;God will be my judge!;;;;;;;;;;;;;x
EVTDESC_Plus_196;Word has reached me that [Root.RelHead.GetTitledFirstName] has had me excommunicated based on fabricated 'evidence' of blasphemy and heresy sent to [Root.RelHead.GetHerHim] in an anonymous letter.;;;;;;;;;;;;;x
EVTOPTA_Plus_196;God preserve me from these lies!;;;;;;;;;;;;;x
EVTDESC_Plus_197;[From.RelHead.GetTitledFirstName] was completely fooled by the fabricated evidence of [From.GetTitledFirstName]'s heresy. [From.GetTitledFirstName] has been excommunicated and interdict has been placed on [From.GetHerHis] lands.;;;;;;;;;;;;;x
EVTOPTA_Plus_197;It was the will of God!;;;;;;;;;;;;;x
EVTDESC_Plus_198;Word has reached me that [Root.RelHead.GetTitledFirstName] has received fabricated 'evidence' of blasphemy and heresy sent to [Root.RelHead.GetHerHim] in an anonymous letter. Fortunately, [Root.RelHead.GetSheHe] dismissed it as the slanderous lie it is.;;;;;;;;;;;;;x
EVTOPTA_Plus_198;God looks after the faithful;;;;;;;;;;;;;x
EVTDESC_Plus_199;[From.RelHead.GetTitledFirstName] refused to believe the fabricated evidence of [From.GetTitledFirstName]'s heresy. Although the scheme has failed, at least there is no evidence of my involvement.;;;;;;;;;;;;;x
EVTDESC_Plus_200;Word has reached me that [Root.RelHead.GetTitledFirstName] has received fabricated 'evidence' of blasphemy and heresy sent to [Root.RelHead.GetHerHim] in an anonymous letter. However, [Root.RelHead.GetSheHe] not only refused to believe it, but had the messenger questioned until he revealed the sender of the letter.;;;;;;;;;;;;;x
EVTOPTA_Plus_200;It was sent by [From.GetTitledFirstName]!;;;;;;;;;;;;;x
EVTDESC_Plus_201;[From.RelHead.GetTitledFirstName] refused to believe the fabricated evidence of [From.GetTitledFirstName]'s heresy. What's worse, [From.RelHead.GetSheHe] had the messenger questioned and found out that I sent it! I have been censured for my 'unseemly scheming' and [From.GetTitledFirstName] knows that I tried to have [From.GetHerHim] excommunicated.;;;;;;;;;;;;;x
EVTOPTA_Plus_201;This will not help my reputation...;;;;;;;;;;;;;x
