#CODE;ENGLISH;FRENCH;GERMAN;;SPANISH;x
EVTDESC_Plus_2062_female;My [Root.GetLordLady],\nI have thought long and hard about this, and I believe I have come to the conclusion that I must dedicate my life utterly to the [Root.Religion.GetName] faith. With your permission, I wish to join a nunnery, though of course I will be available at court, should you need me.\n\nWith respect,\n[From.GetTitledFirstNameNoRegnal];;Meine [Root.GetLordLady],\nIch habe lange und gründlich darüber nachgedacht, und ich glaube, ich bin zu dem Schluss gekommen, dass ich mein Leben ganz dem Glauben an die [Root.Religion.GetName] widmen muss. Mit Eurer Erlaubnis möchte ich in ein Nonnenkloster eintreten, obwohl ich natürlich am Hof zur Verfügung stehen werde, falls Ihr mich braucht.\n\nMit Respekt,\n[From.GetTitledFirstNameNoRegnal];;;x
EVTNAME_Plus_2063;The Order of Saint Blaise;;Der Orden des Heiligen Blasius;;;x
EVTDESC_Plus_2063;In order the stem the tide of infidels and heretics bearing down upon the innocent faithful, a small army of Armenian soldiers and clerics have banded together under the banner of Saint Blaise. With the Latins and Greeks pushing from the west and the Muslims from the East, there is very little these men have aside from unshakeable faith in the power of God to stand between them and their enemies.;;Um der Flut von Ungläubigen und Ketzern Einhalt zu gebieten, die auf die unschuldigen Gläubigen niedergehen, hat sich eine kleine Armee armenischer Soldaten und Kleriker unter dem Banner des Heiligen Blasius zusammengeschlossen. Angesichts des Ansturms der Lateiner und Griechen aus dem Westen und der Muslime aus dem Osten bleibt diesen Männern nicht viel mehr als der unerschütterliche Glaube an die Macht Gottes, um sich zwischen sie und ihre Feinde zu stellen.;;;x
EVTOPTA_Plus_2063;Knights of true Christendom!;;Ritter der wahren Christenheit!;;;x
EVTNAME_Plus_2064;The Knights of Saint Mark;;Die Ritter des heiligen Markus;;;x
EVTDESC_Plus_2064;In order the protect the oppressed faithful from the iron scepter of Muslim domination and the encroachment of the schismatics, the Knights of Saint Mark has arisen to preserve the Coptic populations scattered throughout Egypt and Abyssinia. Tales abound of their courage and tenacity, even against innumerably greater odds.;;Um die unterdrückten Gläubigen vor dem eisernen Zepter der muslimischen Herrschaft und dem Eindringen der Schismatiker zu schützen, sind die Ritter des Heiligen Markus entstanden, um die über ganz Ägypten und Abessinien verstreuten koptischen Bevölkerungsgruppen zu schützen. Es gibt viele Geschichten über ihren Mut und ihre Hartnäckigkeit, selbst gegen unzählige Widerstände.;;;x
