#CODE;ENGLISH;FRENCH;GERMAN;;SPANISH;;;;;;;;;x
EVTDESC_Plus_1354;[From.GetTitledFirstName] listened to my plea for some time. While he ultimately did refuse to legitimize me, he offered me an estate off of which to live. It will make me a [Root.GetLordLady] of [From.PrimaryTitle.GetName], but is that enough?;;;;;;;;;;;;;x
EVTOPTB_Plus_1354;No, it's not enough!;;;;;;;;;;;;;x
EVTDESC_Plus_1355;'Know that I, [From.GetTitledName], hereby consider [Root.GetTitledFirstName] to be my legitimate child and to be considered such throughout [From.PrimaryTitle.GetName]. [Root.GetSheHeCap] will take [Root.GetHerHis] rightful place within the [From.GetOnlyDynastyName] dynasty and among my heirs. By the grace of [From.Religion.GetRandomGodName] shall this be so.';;;;;;;;;;;;;x
EVTDESC_Plus_1361;[From.GetTitledFirstName] has inherited the [FromFrom.GetFullName], a title that should rightfully belong to me. I have the feeling that many of [From.GetHerHis] vassals would agree. Perhaps I should make my case to them?;;;;;;;;;;;;;x
EVTOPTA_Plus_1361;[FromFrom.GetName] is rightfully mine!;;;;;;;;;;;;;x
EVTOPTB_Plus_1361;No, let [From.GetTitledFirstName] have it;;;;;;;;;;;;;x
EVTDESC_Plus_1362;Word reaches you that your [GetFromRelation], [From.GetTitledFirstName], has made a claim against your titles. [From.GetSheHeCap] is trying to win the support of your vassals, and it's possible some of them might actually agree with [From.GetHerHis] cause.;;;;;;;;;;;;;x
EVTOPTA_Plus_1362;Damn [From.GetHerHim]!;;;;;;;;;;;;;x
EVTOPTB_Plus_1362;Throw [From.GetHerHim] in prison at once;;;;;;;;;;;;;x
EVTDESC_Plus_1363;Word reaches you that [FromFrom.GetTitledFirstName] has made a claim against [From.GetTitledFirstName], claiming [FromFrom.GetSheHe] should rightfully have been the heir to the [From.PrimaryTitle.GetFullName]. It is not uncommon for bastards to do this, and you suspect there are some who might agree with [FromFrom.GetHerHis] cause.;;;;;;;;;;;;;x
EVTOPTA_Plus_1363;I agree--[FromFrom.GetSheHe] should rule;;;;;;;;;;;;;x
EVTOPTB_Plus_1363;No, I support [From.GetTitledName];;;;;;;;;;;;;x
EVTDESC_Plus_1370;Recently, you discovered that [Root.Father.GetTitledFirstName] was never your father at all. Should you confront your real father and demand the truth?;;;;;;;;;;;;;x
EVTOPTA_Plus_1370;I need to know the truth;;;;;;;;;;;;;x
EVTOPTB_Plus_1370;I am a [Root.GetOnlyDynastyName], and that's all that matters;;;;;;;;;;;;;x
EVTDESC_Plus_1371;[From.GetTitledFirstName] recently came to me, saying that [From.GetSheHe] recently learned that [From.Father.GetTitledFirstName] was not, in fact, [From.GetHerHis] real father. In fact, [From.GetSheHe] believes I am. It's true, of course, but now [From.GetSheHe] expects an answer...;;;;;;;;;;;;;x
EVTOPTA_Plus_1371;Tell [From.GetHerHim] the truth;;;;;;;;;;;;;x
EVTOPTB_Plus_1371;Deny it;;;;;;;;;;;;;x
EVTOPTC_Plus_1371;Convince [From.GetHerHim] it's not true;;;;;;;;;;;;;x
EVTDESC_Plus_1372;[From.GetTitledFirstName] sighed heavily when I confronted him, but eventually nodded. 'I can't be certain,' he admitted, 'but I was close to your mother once, and you were born during that time. You are my child.';;;;;;;;;;;;;x
EVTOPTA_Plus_1372;Then I want to be recognized as such;;;;;;;;;;;;;x
EVTOPTB_Plus_1372;That's all I wanted to know;;;;;;;;;;;;;x
EVTDESC_Plus_1373;I asked [From.GetTitledFirstName] for the truth, and he looked me straight in the eye and said he wasn't my father. It's not true, of course, but obviously he will lie to my face about it.;;;;;;;;;;;;;x
EVTOPTA_Plus_1373;So be it;;;;;;;;;;;;;x
EVTDESC_Plus_1374;[From.GetTitledFirstName] appeared genuinely confused when I confronted him. 'I knew your mother once, it's true,' he admitted, 'but that's all. [Root.Father.GetTitledFirstName] is surely your father. You even have his look about you.' I felt embarrassed to have even brought it up.;;;;;;;;;;;;;x
EVTOPTA_Plus_1374;I suppose I was mistaken;;;;;;;;;;;;;x
EVTDESC_Plus_1375;To my surprise, [From.GetTitledFirstName] merely nodded and turned to leave after I told [From.GetHerHim] the truth. 'I only wanted to hear it from your own lips,' [From.GetSheHe] said. I wonder if this is the last I will hear of it?;;;;;;;;;;;;;x
EVTDESC_Plus_1376;[From.GetTitledFirstName] nodded when I told [From.GetHerHim] the truth. 'Then recognize me. If I am truly your kin, I want to be known as such. I have rights, do I not?';;;;;;;;;;;;;x
EVTDESC_Plus_1402;[FromFrom.GetTitledFirstName] has asked for an audience with you: 'My [Root.GetLordLady], a vision of [Root.Religion.GetRandomGodName] came to me and commanded that I build a temple in [From.GetName]. I will need your help, however, for I'm uncertain I can complete this grand project on my own.';;;;;;;;;;;;;x
EVTOPTA_Plus_1402;Take this, and my blessing;;;;;;;;;;;;;x
EVTOPTB_Plus_1402;I shall appeal to the [Root.Religion.GetName] faithful on your behalf;;;;;;;;;;;;;x
EVTOPTC_Plus_1402;The lords and ladies of [Root.PrimaryTitle.GetName] will all help you;;;;;;;;;;;;;x
EVTOPTD_Plus_1402;I can spare you nothing;;;;;;;;;;;;;x
EVTOPTE_Plus_1402;I fear I can be of no help to you, [FromFrom.GetTitledFirstName];;;;;;;;;;;;;x
EVTDESC_Plus_1406;With the death of [From.GetTitledFirstName], so dies [From.GetHerHis] dream of building a new temple in [Root.PrimaryTitle.GetName]...;;;;;;;;;;;;;x
EVTDESC_Plus_1408_ruler;My [Root.GetLordLady],\nWould that I could continue construction of the new temple as planned, but my duties in [From.PrimaryTitle.GetName] take me away from such matters. If you can find another to take my place, I recommend that you do so.\n\nWith great respect,\n[From.GetTitledName];;;;;;;;;;;;;x
EVTDESC_Plus_1408_incapable;While the construction of the new temple has been ongoing, it seems that [From.GetTitledFirstName] is no longer in any condition to continue it. Many fear that unless [From.GetSheHe] miraculously recovers [From.GetHerHis] mind or someone else is found to take [From.GetHerHis] place, the project will never finish.;;;;;;;;;;;;;x
EVTDESC_Plus_1408_prison;[From.GetTitledFirstName]'s imprisonment has halted all construction of the new temple. The people are quickly scattering to the winds, returning to their homes...unless someone appears to take [From.GetTitledFirstName]'s place, all hope of it finishing will be lost.;;;;;;;;;;;;;x
EVTDESC_Plus_1412;All construction on the new temple has halted, with [From.GetTitledFirstName] declaring it an impossible task. Unless someone appears soon to take [From.GetHerHis] place, the workers will have scattered to the winds and all hope of the project finishing will vanish.;;;;;;;;;;;;;x
EVTDESC_Plus_1413;My [Root.GetLordLady],\nWould that I had better news to give you. I fear the site where I hoped to erect the [Root.Religion.GetName] temple is no longer suitable. Unless somewhere else can be found, I fear I shall have to abandon my quest in disgrace.\n\nWith respect,\n[From.GetTitledName];;;;;;;;;;;;;x
EVTOPTA_Plus_1413;I have just the place in mind...;;;;;;;;;;;;;x
EVTDESC_Plus_1414;With no-one to urge the locals to continue working, the temple construction in [Root.GetName] has been halted. Unless someone can be found to resume the task, it will have to be abandoned.;;;;;;;;;;;;;x
EVTOPTA_Plus_1414;Someone will be found to continue construction;;;;;;;;;;;;;x
EVTOPTB_Plus_1414;Sadly, there is nothing that can be done;;;;;;;;;;;;;x
EVTOPTA_Plus_1420;Pay for it myself;;;;;;;;;;;;;x
EVTOPTB_Plus_1420;Ask my liege for help;;;;;;;;;;;;;x
EVTDESC_Plus_1421;My [Root.GetLordLady],\nConstruction efforts on the new [Root.Religion.GetName] temple have encountered unforeseen difficulties, and I fear I am completely without resources to continue. I beg you for coin, and I swear by [Root.Religion.GetRandomGodName] it will be put to good use.\n\nYour humble servant,\n[From.GetTitledFirstName];;;;;;;;;;;;;x
EVTOPTA_Plus_1421;Of course I will help [From.GetHerHim];;;;;;;;;;;;;x
EVTOPTB_Plus_1421;I can offer [From.GetHerHim] nothing;;;;;;;;;;;;;x
EVTDESC_Plus_1422;[From.Location.GetName] would be the perfect place to construct a new [Root.Religion.GetName] temple. All that remains is inspiring a pious and ambitious enough courtier to lead the construction and become its servant of [Root.Religion.GetHighGodName] once the temple is completed.;;;;;;;;;;;;;x
EVTOPTA_Plus_1422;I choose [first_temple_choice.GetTitledFirstNameNoRegnal];;;;;;;;;;;;;x
EVTOPTB_Plus_1422;I choose [second_temple_choice.GetTitledFirstNameNoRegnal];;;;;;;;;;;;;x
EVTOPTC_Plus_1422;I choose [third_temple_choice.GetTitledFirstNameNoRegnal];;;;;;;;;;;;;x
EVTOPTD_Plus_1422;Perhaps not, then;;;;;;;;;;;;;x
EVTDESC_Plus_1426;Good news! [From.GetFirstName] has completed work on the new [From.Religion.GetName] temple, assuming [From.GetHerHis] place as its [From.PrimaryTitle.GetRulerTitle]. All of [Root.PrimaryTitle.GetName] rejoices, and a week of celebration has been called for.;;;;;;;;;;;;;x
EVTNAME_Plus_1430;New City Construction;;;;;;;;;;;;;x
EVTDESC_Plus_1430;It has taken years, but finally you have located a suitable site in [Root.Location.GetName] which is both defensible as well as suitable for merchants and tribal leaders alike to gather in a city.;;;;;;;;;;;;;x
EVTOPTA_Plus_1430;I should tell [Root.Liege.GetTitledFirstNameNoRegnal] at once!;;;;;;;;;;;;;x
EVTDESC_Plus_1431;Your [Root.GetTreasurerName], [Root.job_treasurer.GetTitledFirstNameNoRegnal], has discovered a site in [new_city_location.GetName] suitable for building a new city, a place which both merchants and [Root.PrimaryTitle.GetAdjective] leaders believe could support a large number of your people. It will, however, require a fair investment of both time and effort.;;;;;;;;;;;;;x
EVTOPTA_Plus_1431;My coffers will fund this project;;;;;;;;;;;;;x
EVTOPTB_Plus_1431;Everyone in [Root.PrimaryTitle.GetName] will participate;;;;;;;;;;;;;x
EVTOPTC_Plus_1431;We cannot afford such an indulgence;;;;;;;;;;;;;x
EVTDESC_Plus_1433;The war raging in [Root.GetName] has ruined the construction that was underway for the new city. The effort will need to be restarted from scratch.;;;;;;;;;;;;;x
EVTDESC_Plus_1434;There is an issue with the city construction currently underway in [Root.GetName]: a fire destroyed a number of buildings after an accident, and there is a rumor amongst the workers that the site is haunted. It will take considerable convincing to get work to continue.;;;;;;;;;;;;;x
EVTOPTA_Plus_1434;Additional coin will convince them, I'm certain;;;;;;;;;;;;;x
EVTOPTB_Plus_1434;They will continue because the [Root.PrimaryTitle.GetRulerTitle] tell them to!;;;;;;;;;;;;;x
EVTOPTC_Plus_1434;Then we must abandon the project;;;;;;;;;;;;;x
EVTDESC_Plus_1435;It seems several of your overseers have pushed the workers too far. There have been several riots in [Root.GetName], and while construction has not been delayed yet it certainly may come to that if the riots spread further.;;;;;;;;;;;;;x
EVTOPTA_Plus_1435;We will need to keep an eye on things;;;;;;;;;;;;;x
EVTDESC_Plus_1436_tribal;A dispute has arisen with merchants in [Root.GetName], many of whom are unaccustomed to the idea of setting up in buildings as we are asking them to. They prefer their traditional methods, they say. Unless we get the merchants on board with the new city, it will never be completed.;;;;;;;;;;;;;x
EVTDESC_Plus_1436_feudal;A dispute has arisen with merchants in [Root.GetName], many of whom are complaining about inadequate conditions and the difficulty of dealing with local tribesmen who seem to have little idea regarding the importance of such a project. Unless we get the merchants on board with the new city, it will never be completed.;;;;;;;;;;;;;x
EVTOPTA_Plus_1436;I will negotiate with these merchants myself;;;;;;;;;;;;;x
EVTOPTB_Plus_1436;Send [Root.job_treasurer.GetTitledFirstNameNoRegnal] to negotiate with them;;;;;;;;;;;;;x
EVTOPTC_Plus_1436;Round up a few and execute them, to show them their place;;;;;;;;;;;;;x
EVTOPTD_Plus_1436;They are holding out for more coin, I suspect;;;;;;;;;;;;;x
EVTOPTE_Plus_1436;We have no choice but to abandon the project;;;;;;;;;;;;;x
EVTDESC_Plus_1437;After years of effort, the new city in [Root.GetName] is finally complete!;;;;;;;;;;;;;x
EVTDESC_Plus.1454;This decision allows you to play a completely different game. By proceeding you will be able to generate a completely random world with the option of ancient religions, or standard religions. You will even be able to decide if everyone starts as a count, duke or king. Please keep in mind that if this is a multiplayer game only the host should do these options.;;;;;;;;;;;;;x
EVTOPTA_Plus.1454;Sounds intriguing;;;;;;;;;;;;;x
EVTOPTB_Plus.1454;What nonsense;;;;;;;;;;;;;x
EVTDESC_Plus.1455;Would you like to use standard religions, or ancient religions (such as Kemetic, Celtic etc)?\nThe game will appear to be frozen and non-responsive after picking this choice, this is normal and you must simply wait. A lot of messages will also appear afterwards, just hold the enter key to get rid of them easily.;;;;;;;;;;;;;x
EVTOPTA_Plus.1455;Standard Religions;;;;;;;;;;;;;x
EVTOPTB_Plus.1455;Ancient Religions;;;;;;;;;;;;;x
EVTOPTC_Plus.1455;Nevermind;;;;;;;;;;;;;x
EVTDESC_Plus.1456;What tier would you like all independent rulers to be?\n\nAs last time, the game will appear frozen and unresponsive, this is normal just wait it out.;;;;;;;;;;;;;x
EVTOPTA_Plus.1456;Counts;;;;;;;;;;;;;x
EVTOPTB_Plus.1456;Dukes;;;;;;;;;;;;;x
EVTOPTC_Plus.1456;Kings;;;;;;;;;;;;;x
EVTDESC_Plus.1457;The map is now almost done being generated. \n\nPlease run the game at speed 1 for one day, then pause. Once the game has caught up you may finally play. It is highly suggested that you afterwards save your game in case issues arise.;;;;;;;;;;;;;x
EVTOPTA_Plus.1457;Onto a brave new world!;;;;;;;;;;;;;x
EVTDESC_Plus_1500_A;My spies believe they have collected enough information on [target_spy_on.GetTitledFirstName]'s comings and goings that my plot should now have a better chance of success, and indeed should happen more quickly than originally planned.;;;;;;;;;;;;;x
EVTDESC_Plus_1500_B;My spies believe they have collected enough information on [target_spy_on.GetTitledFirstName]'s comings and goings that the plot against [target_spy_on.GetHerHim] should now have a much better chance of success.;;;;;;;;;;;;;x
EVTDESC_Plus_1501;My [Root.GetLordLady],\nMy people have been watching [target_spy_on.GetTitledName] for some time now, and we've acquired enough knowledge of [target_spy_on.GetHerHis] comings and going to help your plot against [target_spy_on.GetHerHim]. With luck, my information will see us to success.\n\nWith respect,\n[From.GetTitledName];;;;;;;;;;;;;x
EVTDESC_Plus_1505;An interesting bit of information has surfaced from my spying on [target_spy_on.GetTitledFirstName]: the man everyone believes to be [[target_spy_on.GetHerHis] father is not. [target_spy_on.GetHerHisCap] mother, [target_spy_on.Mother.GetTitledFirstName] once had a torried affair with [target_spy_on.RealFather.GetTitledName], and it is he who is [target_spy_on.GetTitledFirstName]'s real father.;;;;;;;;;;;;;x
EVTOPTA_Plus_1505;Blackmail [target_spy_on.RealFather.GetTitledFirstName];;;;;;;;;;;;;x
EVTOPTB_Plus_1505;Reveal the truth for all to see;;;;;;;;;;;;;x
EVTOPTC_Plus_1505;I have no interest in this;;;;;;;;;;;;;x
EVTDESC_Plus_1506;My [Root.GetLordLady],\nIt has come to my attention that you are, in truth, the father of [target_spy_on.GetTitledName]. No, there is no need to deny it. I have several letters between yourself and [target_spy_on.Mother.GetTitledFirstName] in my possession. If you do not make it worth my time to keep them to myself, it will be most unfortunate.\n\nSigned,\n[From.GetTitledName];;;;;;;;;;;;;x
EVTDESC_Plus_1507;It seems you leave me no choice. To protect both my own reputation and that of [target_spy_on.GetTitledFirstName], It seems I must do as you demand.\n\nSigned,\n[From.GetTitledName];;;;;;;;;;;;;x
EVTDESC_Plus_1508;You believe I am concerned that anyone might know of [target_spy_on.GetTitledFirstName]'s true lineage? I have borne scandal before. Do your worst, fiend, you shall see no profit in this deed.\n\nSigned,\n[From.GetTitledName];;;;;;;;;;;;;x
EVTOPTA_Plus_1508;Then it seems everyone must know the truth;;;;;;;;;;;;;x
EVTOPTB_Plus_1508;Bah! Fair enough, I'll not go through with it;;;;;;;;;;;;;x
EVTDESC_Plus_1509;News has been circulating throughout court that [Root.Father.GetTitledFirstNameNoRegnal] is not, in fact, your father. They say [target_true_father.GetTitledName] is, and, true or not, it seems everyone believes the scandal. You have been declared a bastard.;;;;;;;;;;;;;x
EVTOPTA_Plus_1509;How can this be??;;;;;;;;;;;;;x
EVTDESC_Plus_1510;News has been circulating throughout court that [target_spy_on.Father.GetTitledName] is not, in fact, the father of [target_spy_on.GetTitledName]. [target_true_father.GetTitledName] is, having once had a torried affair with [target_spy_on.Mother.GetTitledFirstNameNoRegnal], the child kept a secret.;;;;;;;;;;;;;x
EVTOPTA_Plus_1510;Such a scandal!;;;;;;;;;;;;;x
EVTDESC_Plus_1515;My spies have uncovered some interesting information on [target_spy_on.GetTitledFirstNameNoRegnal]: [target_spy_on.GetSheHe] was recently seen in the company of [target_revealed_lover.GetTitledName], and I'm assured the two of them are clearly lovers and have been for some time.;;;;;;;;;;;;;x
EVTOPTA_Plus_1515;Blackmail [target_spy_on.GetTitledFirstNameNoRegnal];;;;;;;;;;;;;x
EVTOPTB_Plus_1515;Blackmail [target_revealed_lover.GetTitledFirstNameNoRegnal];;;;;;;;;;;;;x
EVTOPTC_Plus_1515;Reveal them;;;;;;;;;;;;;x
EVTOPTD_Plus_1515;I have no interest in this;;;;;;;;;;;;;x
EVTDESC_Plus_1516;My [Root.GetLordLady],\nI am aware of your affair with [target_revealed_lover.GetTitledFirstNameNoRegnal]. Unless you would like this knowledge to be made freely available to the world, I suggest you make my silence worthwhile, and soon.\n\nSincerely,\n[From.GetTitledName];;;;;;;;;;;;;x
EVTDESC_Plus_1516_B;My [Root.GetLordLady],\nI am aware of your affair with [target_spy_on.GetTitledFirstNameNoRegnal]. Unless you would like this knowledge to be made freely available to the world, I suggest you make my silence worthwhile, and soon.\n\nSincerely,\n[From.GetTitledName];;;;;;;;;;;;;x
EVTOPTA_Plus_1516;Pay [From.GetHerHim];;;;;;;;;;;;;x
EVTOPTB_Plus_1516;[From.GetSheHeCap] will get nothing from me!;;;;;;;;;;;;;x
EVTDESC_Plus_1517;What you believe you know is barely worth clarifying. Here is coin enough to keep your silence, wretch, for I have not the time to deal with the scandal your wagging tongue would cause.\n\nTake it and go,\n[From.GetTitledName];;;;;;;;;;;;;x
EVTDESC_Plus_1519;Do your worst, [Root.GetTitledFirstNameNoRegnal]. I have not the time to spend on your imaginations, and certainly will not reward you for making threats.\n\nSigned,\n[From.GetTitledName];;;;;;;;;;;;;x
EVTOPTA_Plus_1519;Reveal [From.GetHerHis] affair;;;;;;;;;;;;;x
EVTOPTB_Plus_1519;Let the matter drop;;;;;;;;;;;;;x
EVTDESC_Plus_1525;Your spies have recently overheard [target_spy_on.GetTitledFirstNameNoRegnal] saying some rather unflattering things about [target_new_rival.GetTitledName]. Considering that [target_new_rival.GetTitledFirstNameNoRegnal] also has no love for [target_spy_on.GetHerHim], it might be possible to enflame a rivalry between the two without anyone being the wiser...;;;;;;;;;;;;;x
EVTOPTA_Plus_1525;Make the attempt;;;;;;;;;;;;;x
EVTOPTB_Plus_1525;No, I don't want to risk it;;;;;;;;;;;;;x
EVTDESC_Plus_1526;Success! A few rumors spread in the courts of both [target_spy_on.GetTitledFirstNameNoRegnal] and [target_new_rival.GetTitledFirstNameNoRegnal] have resulted in their mutual dislike blossoming into a new rivalry. Now all that remains is to see where this leads...;;;;;;;;;;;;;x
EVTDESC_Plus_1527;You've never cared for [target_new_rival.GetTitledName] overly much, nor [target_new_rival.GetSheHe] for you, but lately your court is constantly filled with rumors of the terrible things [target_new_rival.GetSheHe] has been saying about you. It is beyond the pale, and enough is enough!;;;;;;;;;;;;;x
EVTOPTA_Plus_1527;How dare [target_new_rival.GetSheHe]!;;;;;;;;;;;;;x
EVTDESC_Plus_1528;You've never cared for [target_spy_on.GetTitledName] overly much, nor [target_spy_on.GetSheHe] for you, but lately your court is constantly filled with rumors of the terrible things [target_spy_on.GetSheHe] has been saying about you. It is beyond the pale, and enough is enough!;;;;;;;;;;;;;x
EVTOPTA_Plus_1528;How dare [target_spy_on.GetSheHe]!;;;;;;;;;;;;;x
EVTDESC_Plus_1529;While you've filled the courts of both [target_spy_on.GetTitledFirstNameNoRegnal] and [target_new_rival.GetTitledFirstNameNoRegnal] with rumors, neither of them seems to have taken the bait. At best, they are irritated with each other. Thankfully, neither has clued into the fact that the rumors have come from you.;;;;;;;;;;;;;x
EVTDESC_Plus_1530;You've never cared for [target_new_rival.GetTitledName] overly much, nor [target_new_rival.GetSheHe] for you, but lately your court is filled with constant rumors regarding how much [target_new_rival.GetSheHe] dislikes you. Even so, you find it hard to credit this talk as more than just talk.;;;;;;;;;;;;;x
EVTOPTA_Plus_1530;I so despise court gossip;;;;;;;;;;;;;x
EVTDESC_Plus_1531;You've never cared for [target_spy_on.GetTitledName] overly much, nor [target_spy_on.GetSheHe] for you, but lately your court is filled with constant rumors regarding how much [target_spy_on.GetSheHe] dislikes you. Even so, you find it hard to credit this talk as more than just talk.;;;;;;;;;;;;;x
EVTDESC_Plus_1532;Alas, while you've filled the courts of both [target_spy_on.GetTitledFirstNameNoRegnal] and [target_new_rival.GetTitledFirstNameNoRegnal] with rumors, neither appears to have taken the bait. Worse, their suspicions that someone is behind these rumors has been raised. Your hand may have been revealed.;;;;;;;;;;;;;x
EVTDESC_Plus_1533;You've never cared for [target_new_rival.GetTitledName] overly much, nor [target_new_rival.GetSheHe] for you, but lately your court is constantly filled with rumors of the terrible things [target_new_rival.GetSheHe] has been saying about you. It turns out, however, that the rumors are false and come from [From.GetTitledName], who has been attempting to stir a rivalry.;;;;;;;;;;;;;x
EVTOPTA_Plus_1533;How dare [From.GetSheHe]!;;;;;;;;;;;;;x
EVTDESC_Plus_1534;You've never cared for [target_spy_on.GetTitledName] overly much, nor [target_spy_on.GetSheHe] for you, but lately your court is constantly filled with rumors of the terrible things [target_spy_on.GetSheHe] has been saying about you. It turns out, however, that the rumors are false and come from [From.GetTitledName], who has been attempting to stir a rivalry.;;;;;;;;;;;;;x
EVTDESC_Plus_1540;Your spies report that [target_spy_on.GetTitledFirstNameNoRegnal] is not on good terms with [target_spy_on.GetHerHis] liege, [target_new_rival.GetTitledName]. Indeed, it might be possible to plant rumors and sour relations between them even further...;;;;;;;;;;;;;x
EVTDESC_Plus_1541;Success! Rumors planted in the courts of both [target_spy_on.GetTitledFirstNameNoRegnal] and [target_new_rival.GetTitledFirstNameNoRegnal] have stirred up animosity between them both, with neither aware that you are the one responsible. Now it only remains to see what comes of this.;;;;;;;;;;;;;x
EVTDESC_Plus_1542;While you have no great love for your liege, recently you've heard far too many rumors regarding how much [target_new_rival.GetTitledFirstNameNoRegnal] dislikes you. You were disinclined to believe them, but the way [target_new_rival.GetTitledFirstNameNoRegnal] glared at you at your last meeting has persuaded you otherwise.;;;;;;;;;;;;;x
EVTOPTA_Plus_1542;So that's how it is, is it?;;;;;;;;;;;;;x
EVTDESC_Plus_1543;While you have no great love for [target_spy_on.GetTitledName], you had no idea that [target_spy_on.GetSheHe] despised you so much until you began hearing rumors of [target_spy_on.GetHerHis] hateful comments. When you last saw [target_spy_on.GetHerHim] at court, the glares [target_spy_on.GetSheHe] shot your way confirmed your suspicions.;;;;;;;;;;;;;x
EVTDESC_Plus_1544;While you planted rumors in [target_new_rival.GetTitledFirstNameNoRegnal]'s court regarding [target_spy_on.GetTitledFirstNameNoRegnal], they have been lost amidst all the hubbub of [target_new_rival.GetHerHis] daily duties and thus were ignored. Thankfully, neither [target_new_rival.GetSheHe] nor [target_spy_on.GetTitledFirstNameNoRegnal] are aware of your attempt to cause trouble.;;;;;;;;;;;;;x
EVTDESC_Plus_1545;Alas, while you planted rumors in [target_new_rival.GetTitledFirstNameNoRegnal]'s court regarding [target_spy_on.GetTitledFirstNameNoRegnal], they have been mostly ignored...and, far worse, you believe they have begun to suspect your involvement in starting them.;;;;;;;;;;;;;x
EVTDESC_Plus_1546;There have been far too many rumors lately regarding [target_new_rival.GetTitledFirstNameNoRegnal]'s supposed dislike of you...enough so that you were prompted to investigate, only to discover rumors that you hated [target_new_rival.GetHerHim] as well! The rumors were spread by [From.GetTitledName], who is evidently attempting to cause trouble between you.;;;;;;;;;;;;;x
EVTOPTA_Plus_1546;How dare [From.GetSheHe]!;;;;;;;;;;;;;x
EVTDESC_Plus_1547;There have been far too many rumors lately regarding [target_spy_on.GetTitledFirstNameNoRegnal]'s supposed dislike of you...enough so that you were prompted to investigate, only to discover rumors that you hated [target_spy_on.GetHerHim] as well! The rumors were spread by [From.GetTitledName], who is evidently attempting to cause trouble between you.;;;;;;;;;;;;;x
EVTDESC_Plus_1550;Through constant prayer and dedication to virtue, all the stress you feel has started to...simply melt away. Perhaps this is the peace a simpler life entails.;;;;;;;;;;;;;x
EVTOPTA_Plus_1550;I shall renew my dedication to God;;;;;;;;;;;;;x
