#CODE;ENGLISH;FRENCH;GERMAN;;SPANISH;x
pattern_interaction_deserves_execution;This character deserves execution\n;;Dieser Charakter verdient die Hinrichtung\n;;;x
pattern_interaction_not_deserves_execution;This character does not deserve execution\n;;Dieser Charakter verdient nicht die Hinrichtung\n;;;x
pattern_interaction_deserves_exile;This character deserves exile\n;;Dieser Charakter verdient die Verbannung\n;;;x
pattern_interaction_not_deserves_exile;This character does not deserve exile\n;;Dieser Charakter verdient nicht die Verbannung\n;;;x
pattern_interaction_deserves_imprisonment;This character deserves imprisonment\n;;Dieser Charakter verdient eine Inhaftierung\n;;;x
pattern_interaction_not_deserves_imprisonment;This character does not deserve imprisonment\n;;Dieser Charakter verdient keine Haftstrafe\n;;;x
