#CODE;ENGLISH;FRENCH;GERMAN;;SPANISH;;;;;;;;;x
EVTDESC_Plus_2646;As you continue your search for God and saintly status, your honest nature becomes better-known to those around you. Indeed, you recently told the truth to a visiting courtier when a lie would have served you far better...and the man was so impressed he told the tale far and wide.;;;;;;;;;;;;;x
EVTDESC_Plus_2647;As you continue your search for God and saintly status, your sense of justice becomes better-known to those around you. The people of [Root.PrimaryTitle.GetName] consider you a fair and wise ruler, trusting your edicts like they would almost no other, and an example to selfish rulers elsewhere.;;;;;;;;;;;;;x
EVTDESC_Plus_2648;As you continue your search for God and saintly status, your devotion to theology has gained you a great deal of admiration. '[Root.GetTitledFirstNameNoRegnal] is a true Christian scholar,' they say, and many eagerly await copies of your studies on God and true faith.;;;;;;;;;;;;;x
EVTDESC_Plus_2649;There are those who have questioned the voice you claim to hear, suggesting it is not Jesus but a demon, or worse. Now it seems that tide has turned, and more people in [Root.PrimaryTitle.GetName] are realizing that perhaps you do have a connection to the Divine, that you have been touched by God Himself.;;;;;;;;;;;;;x
EVTOPTA_Plus_2649;Jesus shall guide them, as he does me;;;;;;;;;;;;;x

ATTEMPT_FAILS;The attempt fails, perhaps with consequences...\n;;;;;;;;;;;;;x
ATTEMPT_SUCCEEDS;The attempt succeeds, perhaps with a price...\n;;;;;;;;;;;;;x
PRIEST_CONDEMNS;[doubting_priest.GetBestName] finds you wanting...\n;;;;;;;;;;;;;x
PRIEST_WON_OVER;[doubting_priest.GetBestName] is convinced of your piety\n;;;;;;;;;;;;;x