#CODE;ENGLISH;FRENCH;GERMAN;;SPANISH;;;;;;;;;x
EVTDESC_Plus_2124;A recent revival of Bogomilist traditionalism has taken hold in [PrimaryTitle.GetName], with numerous preachers cropping up who actively deride your efforts to reform the faith as being exactly the same sort of tyrannical structure they rebelled against in the first place. Needless to say, this has not been helpful.;;;;;;;;;;;;;x
EVTDESC_Plus_2125;A prominent Perfecti in [demand_province.GetName] has publicly begged that you slow down, if not outright stop, the process of Bogomilist reform. The common folk are confused by these contradictions, he says, and continuing down this path too quickly will only bring down God's wrath. The Perfecti is too popular to be silenced, as doing so would turn him into a martyr for his cause.;;;;;;;;;;;;;x
EVTOPTA_Plus_2125;Do as he asks, for now;;;;;;;;;;;;;x
EVTOPTB_Plus_2125;Ignore him;;;;;;;;;;;;;x
EVTDESC_Plus_2126;A set of crop failures and other disasters that has fallen one of your provinces in recent months has stirred the ire of several fiery preaches in the area. They say that you are to blame, that your desire for reforms and general lack of piety is what has brought down God's wrath upon the people of [Root.PrimaryTitle.GetName]. Sadly, their words have taken hold amongst many.;;;;;;;;;;;;;x
EVTDESC_Plus_2127;A prominent Perfecti has recently taken issue with your desire to reform the Bogomilist faith, pointing out a number of flaws in your argument without ever actually saying outright that your intention is solely to grab power and force the faithful into compliance. To her, you are not a learned enough [Root.GetManWoman] to push such things forward, and there is no convincing her otherwise.;;;;;;;;;;;;;x
EVTDESC_Plus_2128;[Root.GetTitledName]'s recent victory against [From.GetTitledName] in [Root.Location.GetName] has been hailed as a major victory for Bogomilism, and has spread the notion that perhaps the continuing reforms of the faith have God's favor after all.;;;;;;;;;;;;;x
EVTDESC_Plus_2129;[Root.GetTitledName]'s recent staggering loss against [From.GetTitledName] in [Root.Location.GetName] has been hailed as a sign that the ongoing reforms of the Bogomilist faith do not have God's favor after all.;;;;;;;;;;;;;x
EVTNAME_Plus_2130;Bogomilist Faith Organized;;;;;;;;;;;;;x
EVTDESC_Plus_2130;In its inception, the Bogomilist faith was only loosely organized. It didn't believe in formal churches, and opposed any kind of formal hierarchy -- this has all changed with the leadership of [Root.GetTitledName], whose piety and status as a Perfecti has encouraged all members of [Root.GetHerHis] faith to reconsider their resistance to feudal structures. Bogomilists across the world are now more formally organized, though many still do not consider them a true religion, and they remain opposed to any kind of formal church that emulates the Orthodox priesthood. Even so, there are many that object to even these changes, saying that Bogomilism has betrayed its own roots at a powerful [Root.GetLordLady]'s behest.;;;;;;;;;;;;;x
EVTOPTA_Plus_2130;A better day for us all;;;;;;;;;;;;;x
EVTNAME_Plus_2131;Bogomilist Faith Formalized;;;;;;;;;;;;;x
EVTDESC_Plus_2131;Though the faithful were hardly ready for it, Bogomilism has now been formalized as a structured religion thanks to the leadership of [Root.GetTitledName]. While many see [Root.GetHerHis] leadership and piety as being worthwhile to follow, there are many who claim [Root.GetSheHe] has dragged the faith too fast into something which too much resembles the very kind of tyrannical structures they once abandoned. Preachers throughout [Root.PrimaryTitle.GetName] are questioning how far this will go, and whether the [Root.PrimaryTitle.GetRulerTitle] has not perhaps betrayed Bogomilism's principles for the sake of power. Whatever the case, Bogomilist priests are now unified under a common liturgy, a single sacred text, and operate out of temples -- far more than the disparate heretics from where they sprang.;;;;;;;;;;;;;x
EVTOPTA_Plus_2131;This is how it must be;;;;;;;;;;;;;x
EVTOPTB_Plus_2131;Are we truly ready for this?;;;;;;;;;;;;;x
EVTDESC_Plus_2132;After a long and arduous process of reform, the Bogomilist faith can now truly be considered a formal religion. Under the considered leadership and piety of [Root.GetTitledName], Bogomilist priests are now unified under a common liturgy, a single sacred text, and operate out of temples -- far more than the disparate heretics from where they sprang. While some question whether these reforms betray the principles upon which Bogomilism was founded, far more say they were agreed to by all and with due consideration. The faith is now ready to come into its own.;;;;;;;;;;;;;x
EVTTITLE_Plus_2134;The Bogomilist Patriarchy;;;;;;;;;;;;;x
EVTDESC_Plus_2134;At the behest of [Root.GetTitledName], [new_bogomilist_patriarch.GetTitledName] has been elected as the head of the newly-founded Bogomilist Church, Bogomilism having completely transformed itself from an Orthodox heresy into a fully-formed religion in its own right. Christian leaders elsewhere have been forced to recognize this new faith as a force in its own right, and its inception as a schism from standard Christianity rather than a true heresy.;;;;;;;;;;;;;x
EVTOPTA_Plus_2134;It appears we must accept this now;;;;;;;;;;;;;x
EVTOPTB_Plus_2134;Heretics or not, they are still Christians;;;;;;;;;;;;;x
EVTDESC_Plus_2135;Construction has begun in Tyrnovo on the planned Church of St. Bogomil, a structure to rival St. Peter's Basilica or the Hagia Sophia. It will surely be a marvel of construction, and a bastion of faith for all Bogomilists across the world!;;;;;;;;;;;;;x
EVTOPTA_Plus_2135;Let us hope I live to see it finished;;;;;;;;;;;;;x
EVTNAME_Plus_2137;The Church of St. Bogomil;;;;;;;;;;;;;x
EVTDESC_Plus_2137;As evidence of just how far the Bogomilist faith has come, the Church of St. Bogomil has completed construction in the city of Tyrnovo. A majestic structure to rival even the most potent Christian cathedrals, the church has become a bastion of faith for all Bogomilists across [Root.PrimaryTitle.GetName] and beyond.;;;;;;;;;;;;;x
EVTOPTA_Plus_2137;St. Bogomil himself would be pleased;;;;;;;;;;;;;x
EVTNAME_Plus_2230;The Council of [council_location.GetName];;;;;;;;;;;;;x
EVTDESC_Plus_2230;At the behest of [council_holder.GetTitledName], an ecumenical council is to take place at [council_location.GetName], one which many believe will end the Great Schism which has divided the western and eastern branches of Christianity once and for all. [target_religion.GetTitledName] is said to be arriving, as is a horde of priests, patriarchs, and senior members of both the [mender_religion.Religion.GetName] and [target_religion.Religion.GetName] faiths. Unlike previous councils, there is a feeling that the Great Schism may actually be resolved -- indeed, with the influence that [council_holder.GetTitledFirstNameNoRegnal] holds amongst the faithful, it may very well be that the [target_religion.PrimaryTitle.GetRulerTitle] has no choice but to agree to the council's resolutions even if the result would turn [target_religion.GetHerHim] into a virtual heretic. [target_religion.Religion.GetName] rulers across the world are already considering whether they must submit to this new order of [mender_religion.Religion.GetName] dominance.;;;;;;;;;;;;;x
EVTOPTA_Plus_2230;Let the council begin!;;;;;;;;;;;;;x
EVTOPTA_Plus_2231;I will become [mender_religion.Religion.GetName];;;;;;;;;;;;;x
EVTOPTB_Plus_2231;No, I am [target_religion.Religion.GetName]!;;;;;;;;;;;;;x
EVTOPTC_Plus_2231;This is of great concern...;;;;;;;;;;;;;x
EVTOPTD_Plus_2231;A truly glorious day;;;;;;;;;;;;;x
EVTOPTE_Plus_2231;This has nothing to do with us;;;;;;;;;;;;;x
EVTDESC_Plus_2232;After more than a month of heated deliberations, the Council of [council_location.GetName] has ended. The process began by [council_holder.GetTitledName] has ended with the [mender_religion.Religion.GetName] faith standing triumphant. What few members of the [target_religion.Religion.GetName] faith remain are now considered heretics, with most having already converted. The Great Schism is now officially ended.;;;;;;;;;;;;;x
EVTOPTA_Plus_2232;May God watch over us all;;;;;;;;;;;;;x
EVTOPTB_Plus_2232;It will break apart again, just watch;;;;;;;;;;;;;x
EVTOPTC_Plus_2232;The Christians united? A frightening thought!;;;;;;;;;;;;;x
EVTDESC_Plus_2234;At the behest of [council_holder.GetTitledName], an ecumenical council is to take place at [council_location.GetName], one which seems ready to finally resolve the Council of Ephesus from the 5th Century -- that historic event which originally repudiated Nestorianism and caused the creation of the Church of the East. [target_religion.GetTitledName] is said to be arriving, as is a large number of priests, patriarchs, and senior members of both the [mender_religion.Religion.GetName] and [target_religion.Religion.GetName] faiths, almost too many for [council_location.GetName] to contain. With [council_holder.GetTitledFirstNameNoRegnal]'s influence backing the council, it is believed the Nestorians will be brought into the [mender_religion.Religion.GetName] fold, something even the [target_religion.PrimaryTitle.GetRulerTitle] will likely have no choice but to agree to even if this will turn [target_religion.GetHerHim] into a virtual heretic. Already [target_religion.Religion.GetName] rulers across the world are considering whether they will heed the council's wishes and convert.;;;;;;;;;;;;;x
EVTDESC_Plus_2237;After more than a month of heated deliberations, the Council of [council_location.GetName] has ended. The process began by [council_holder.GetTitledName] has ended with the [mender_religion.Religion.GetName] faith standing triumphant. What few members of the [target_religion.Religion.GetName] faith remain are now considered heretics, with most having already converted. The original Council of Ephesus has been enforced, and Nestorianism is officially no more.;;;;;;;;;;;;;x
EVTOPTB_Plus_2237;A few centuries late, I'd say;;;;;;;;;;;;;x
EVTOPTC_Plus_2237;Victory over a dead religion? How grand;;;;;;;;;;;;;x
EVTDESC_Plus_2238;At the behest of [council_holder.GetTitledName], an ecumenical council is to take place at [council_location.GetName], one which seems ready to finally resolve the Council of Chalcedon from the 5th Century -- that historic event which originally repudiated 'monophysitism' and caused its believers to split from the Christian Church. Both [target_religion1.GetTitledName] [target_religion2.GetTitledName] are said to be arriving, as is a large number of priests, patriarchs, and senior members of the [mender_religion.Religion.GetName] faith. With [council_holder.GetTitledFirstNameNoRegnal]'s influence backing the council, it is believed the miaphysites will finally be brought into the fold, something even the [target_religion1.PrimaryTitle.GetRulerTitle] and [target_religion2.PrimaryTitle.GetRulerTitle] will be powerless to oppose. Already [target_religion1.Religion.GetName]  and [target_religion2.Religion.GetName] rulers across the world are considering whether they will heed the council's wishes and convert.;;;;;;;;;;;;;x
EVTDESC_Plus_2241;After more than a month of heated deliberations, the Council of [council_location.GetName] has ended. The process began by [council_holder.GetTitledName] has ended with the [mender_religion.Religion.GetName] faith standing triumphant. What few members of the [target_religion1.Religion.GetName] and [target_religion2.Religion.GetName] faiths remain are now considered heretics, with most having already converted. The original Council of Chalcedon has been enforced, and miaphysitism is officially no more.;;;;;;;;;;;;;x
EVTOPTB_Plus_2238;There weren't many to begin with, were there?;;;;;;;;;;;;;x
EVTDESC_Plus_2242;At the behest of [council_holder.GetTitledName], an unprecedented ecumenical council is to take place at [council_location.GetName], one which will address the Council of Ephesus from the 5th Century -- that historic event which originally repudiated Nestorianism and caused the creation of the Church of the East. This time, however, Nestorianism is set to unite the eastern churches under its doctrine. [target_religion.GetTitledName] is said to be arriving, as is a large number of priests, patriarchs, and senior members of both the [mender_religion.Religion.GetName] and [target_religion.Religion.GetName] faiths. With [council_holder.GetTitledFirstNameNoRegnal]'s influence backing the council, the [target_religion.PrimaryTitle.GetRulerTitle] will likely have no choice but to accede to the council even if this will turn [target_religion.GetHerHim] into a virtual heretic. Already [target_religion.Religion.GetName] rulers across the world are considering whether to accept the inevitable and convert.;;;;;;;;;;;;;x
EVTDESC_Plus_2245;After more than a month of heated deliberations, the Council of [council_location.GetName] has ended. The process began by [council_holder.GetTitledName] has ended with the [mender_religion.Religion.GetName] faith standing triumphant. What few members of the [target_religion.Religion.GetName] faith remain are now considered heretics, with most having already converted. The original Council of Ephesus has been officially repudiated, the teachings of Nestorius vindicated, and [target_religion.Religion.GetName] Christianity has been forced into submission.;;;;;;;;;;;;;x
EVTOPTB_Plus_2245;Well, that was an unexpected turn of history...;;;;;;;;;;;;;x
EVTOPTC_Plus_2245;These differences are important to Christians, then?;;;;;;;;;;;;;x
EVTDESC_Plus_2246;At the behest of [council_holder.GetTitledName], an unprecedented ecumenical council is to take place at [council_location.GetName], one which will address the Council of Chalcedon from the 5th Century -- that historic event which originally repudiated 'monophysitism' and split its believers from the Christian Church. This time, however, the [mender_religion.Religion.GetName] faith is set to unite the eastern churches under its doctrine. [target_religion1.GetTitledName] is said to be arriving, as is [target_religion2.GetTitledName] -- who faces the prospect of a union of miaphysites, whether [target_religion2.GetSheHe] wishes it or no. With [council_holder.GetTitledFirstNameNoRegnal]'s influence backing the council, neither leader will likely have any choice but to accede to its wishes even if this will turn them into virtual heretics. Already [target_religion1.Religion.GetName] and [target_religion2.Religion.GetName] rulers across the world are considering whether to accept the inevitable and convert.;;;;;;;;;;;;;x
EVTDESC_Plus_2246_no_second;At the behest of [council_holder.GetTitledName], an unprecedented ecumenical council is to take place at [council_location.GetName], one which will address the Council of Chalcedon from the 5th Century -- that historic event which originally repudiated 'monophysitism' and split its believers from the Christian Church. This time, however, the [mender_religion.Religion.GetName] faith is set to unite the eastern churches under its doctrine. [target_religion1.GetTitledName] is said to be arriving, as is a large number of priests, patriarchs, and senior members of both the [mender_religion.Religion.GetName] and [target_religion1.Religion.GetName] faiths. With [council_holder.GetTitledFirstNameNoRegnal]'s influence backing the council, the [target_religion.PrimaryTitle.GetRulerTitle] will likely have no choice but to accede to its wishes even if this will turn [target_religion.GetHerHim] into a virtual heretic. Already [target_religion1.Religion.GetName] and [target_religion2.Religion.GetName] rulers across the world are considering whether to accept the inevitable and convert.;;;;;;;;;;;;;x
EVTDESC_Plus_2249;After more than a month of heated deliberations, the Council of [council_location.GetName] has ended. The process began by [council_holder.GetTitledName] has ended with the [mender_religion.Religion.GetName] faith standing triumphant. What few members of the [target_religion1.Religion.GetName] faith remain are now considered heretics, with most having already converted. The original Council of Chalcedon has been officially repudiated, the Miaphysite Christology accepted as supreme in the east, and [target_religion1.Religion.GetName] Christianity has been forced into submission.;;;;;;;;;;;;;x
EVTDESC_Plus_2250;At the behest of [council_holder.GetTitledName], an unprecedented ecumenical council is to take place at [council_location.GetName], one that is expected to see the Great Schism between western and eastern Christianity ended once and for all. [target_religion.GetTitledName] is said to be arriving, as are thousands of priests, patriarchs, and senior members of both the [mender_religion.Religion.GetName] and [target_religion.Religion.GetName] faiths, almost too many for [council_location.GetName] to contain. With [council_holder.GetTitledFirstNameNoRegnal]'s influence backing the council, it is believed the [target_religion.Religion.GetName] will be brought into the [mender_religion.Religion.GetName] fold, something even the [target_religion.PrimaryTitle.GetRulerTitle] will likely have no choice but to agree to even if this will turn [target_religion.GetHerHim] into a virtual heretic. Already [target_religion.Religion.GetName] rulers across the world are considering whether they will heed the council's inevitable wishes and convert.;;;;;;;;;;;;;x
EVTDESC_Plus_2253;It is done. After more than a month of heated deliberations, the Council of [council_location.GetName] has ended. The process began by [council_holder.GetTitledName] has resulted in the [mender_religion.Religion.GetName] faith standing triumphant. What few members of the [target_religion.Religion.GetName] faith remain are now considered heretics, with most having already converted. Christianity is at last united under the [mender_religion.PrimaryTitle.GetRulerTitle], a single force to spread the Gospel across the known world.;;;;;;;;;;;;;x
EVTDESC_Plus_2275;Now that you are the [Root.PrimaryTitle.GetRulerTitle] of [Root.PrimaryTitle.GetName], you must choose whether you follow the Greek or Latin rites of the Christian faith.;;;;;;;;;;;;;x
EVTOPTA_Plus_2275;I shall follow the Latin rites;;;;;;;;;;;;;x
EVTOPTB_Plus_2275;I shall follow the Greek rites;;;;;;;;;;;;;x
EVTDESC_Plus_2277_latin;[rightful_relhead.GetTitledName] has contacted you, demanding that you switch to the Latin Rites. As [rightful_relhead.GetSheHe] has primacy within the [Root.PrimaryTitle.GetFullName], it is within [rightful_relhead.GetHerHis] right to make such a demand...but it is also your right to refuse.;;;;;;;;;;;;;x
EVTDESC_Plus_2277_greek;[rightful_relhead.GetTitledName] has contacted you, demanding that you switch to the Greek Rites. As [rightful_relhead.GetSheHe] has primacy within the [Root.PrimaryTitle.GetFullName], it is within [rightful_relhead.GetHerHis] right to make such a demand...but it is also your right to refuse.;;;;;;;;;;;;;x
EVTOPTA_Plus_2277;I will follow the traditions I always have;;;;;;;;;;;;;x
EVTOPTB_Plus_2277;I bow before [rightful_relhead.GetHerHis] demand;;;;;;;;;;;;;x
EVTNAME_Plus_2278;Two Roman Emperors?;;;;;;;;;;;;;x
EVTDESC_Plus_2278;[Root.GetTitledName] has invoked the translatio imperii, and been given the blessing of Pope [current_roman_pope.GetFirstName] as the ruler of a Roman Empire reborn. This naturally does not sit well with [current_byzantine_emperor.GetTitledName], who maintains that the Pope does not have the right to bestow such a title. Indeed, the Pope doing so could imply either that [current_byzantine_emperor.GetTitledFirstNameNoRegnal] is not the *true* Roman [current_byzantine_emperor.PrimaryTitle.GetRulerTitle] or that [Root.GetTitledFirstNameNoRegnal] has some manner of authority over [current_byzantine_emperor.GetHerHis] realm. Either way, Greek bishops throughout Europe are furious, seeing this as yet more evidence of the Pope's attempts to establish primacy despite the Council of Chalcedon having clearly placed Constantinople as the seat of Christianity's highest ecclesiastical court.;;;;;;;;;;;;;x
EVTOPTA_Plus_2278;The Pope oversteps [current_roman_pope.GetHerHis] bounds;;;;;;;;;;;;;x
EVTOPTB_Plus_2278;There were two Roman Empires before -- what is the problem?;;;;;;;;;;;;;x
EVTOPTC_Plus_2278;More divisions amongst righteous Christians?;;;;;;;;;;;;;x
EVTOPTD_Plus_2278;So the Christians bicker amongst themselves;;;;;;;;;;;;;x
EVTNAME_Plus_2279;The Erosion of Christianity;;;;;;;;;;;;;x
EVTDESC_Plus_2279;With the war currently ongoing between [Root.GetTitledName] and [papal_emperor.GetTitledName], questions have begun to rise about the unity of Chalcedonian Christianity. [papal_emperor.GetTitledFirstName] was crowned by the Pope, was [papal_emperor.GetSheHe] not? Does that not make [papal_emperor.GetHerHim] the Pope's champion? Yet here [papal_emperor.GetSheHe] stands, at war with the [Root.PrimaryTitle.GetRulerTitle] who stands at the center of the eastern Christian faith. Divisions between Latin and Greek Christians have been deepening for years, but this war brings into sharp focus just how bad things have become. More and more, bishops on both sides are talking about a coming schism that could rend Christianity in two.;;;;;;;;;;;;;x
EVTOPTA_Plus_2279;The [papal_emperor.PrimaryTitle.GetRulerTitle] is clearly to blame for this;;;;;;;;;;;;;x
EVTOPTB_Plus_2279;The [Root.PrimaryTitle.GetRulerTitle] is clearly to blame for this;;;;;;;;;;;;;x
EVTOPTC_Plus_2279;This bodes ill for us all;;;;;;;;;;;;;x
EVTOPTD_Plus_2279;The coming schism is clearly inevitable;;;;;;;;;;;;;x
EVTNAME_Plus_2280;Adoption of the Filioque;;;;;;;;;;;;;x
EVTDESC_Plus_2280;'And in the Holy Spirit, the Lord, the giver of life,\nwho proceeds from the Father and the Son,\nwho with the Father and the Son is adored and glorified.'\n\nThe original Nicene Creed, established at the First Council of Nicaea in 325AD, did not have the phrase 'and the Son' added to 'who proceeds from the Father'. This is referred to as the Filioque, and by the decree of Pope [Root.GetFirstName] it has been added to the creed used by Latin bishops, to underline the importance of the Son in the Trinity...and reoundingly rejected by the vast majority of Greek bishops, who are furious that the Pope did so without calling an ecumenical council. To most, this is yet another example of the growing division between Greek and Latin Christianity.;;;;;;;;;;;;;x
EVTOPTA_Plus_2280;The Pope oversteps [Root.GetHerHis] bounds once again!;;;;;;;;;;;;;x
EVTOPTB_Plus_2280;Do they seriously reject the Son's true importance?;;;;;;;;;;;;;x
EVTOPTC_Plus_2280;Surely some kind of compromise can be reached?;;;;;;;;;;;;;x
EVTNAME_Plus_2281;Papal Jurisdiction;;;;;;;;;;;;;x
EVTDESC_Plus_2281;A recent rare meeting between [Root.GetTitledFirstName] and [current_patriarch.GetTitledFirstName] in Constantinople to discuss the ecclesiastical jurisdiction over [jurisdiction_realm.PrimaryTitle.GetName] was said to end in near-chaos, with [Root.GetTitledFirstNameNoRegnal] storming out of the cathedral in a fury. The Pope claims that [jurisdiction_realm.PrimaryTitle.GetName] falls within [Root.GetHerHis] rightful domain, while [current_patriarch.GetTitledFirstNameNoRegnal] claims [jurisdiction_realm.PrimaryTitle.GetName] has never been part of either ecclesiastical realm, and that this is yet another example of the Pope striving to assert primacy where it is not warranted. This latest conflict over papal jurisdiction has left both patriarchs almost unwilling to communicate at all, a fact which has left many of their bishops extremely worried.;;;;;;;;;;;;;x
EVTOPTA_Plus_2281;[jurisdiction_realm.PrimaryTitle.GetName] is its own domain, clearly;;;;;;;;;;;;;x
EVTOPTB_Plus_2281;So [jurisdiction_realm.PrimaryTitle.GetName] should be left without a proper Patriarch?;;;;;;;;;;;;;x
EVTOPTC_Plus_2281;This bickering does no-one any good...;;;;;;;;;;;;;x
EVTNAME_Plus_2282;Conflict Over the Eucharist;;;;;;;;;;;;;x
EVTDESC_Plus_2282_greek;A dispute between [Root.GetTitledName] and a number of [Root.GetHerHis] Latin priests has quickly spread to the highest reaches of Christian rule. [Root.GetTitledFirstNameNoRegnal], [Root.GetHerHim]self a follower of the Greek rites, took to task a number of priests in [Root.GetHerHis] realm who were using unleavened bread while administering the Eucharist, calling them 'azymites' and ultimately ordering their arrest. The priests complained, outraged, and their anger spread to other Latin realms, resulting in a series of sweeping edicts against several Greek practices. Greek bishops have responded in kind, and while leaders have allowed the matter to blow over, the simmering anger between both sides remains sharp and clear.;;;;;;;;;;;;;x
EVTDESC_Plus_2282_latin;A dispute between [Root.GetTitledName] and a number of [Root.GetHerHis] Greek priests has quickly spread to the highest reaches of Christian rule. [Root.GetTitledFirstNameNoRegnal], [Root.GetHerHim]self a follower of the Latin rites, took to task a number of priests in [Root.GetHerHis] realm who were using leavened bread while administering the Eucharist, calling them 'prozymites' and ultimately ordering their arrest. The priests complained, outraged, and their anger spread to other Greek realms, resulting in a series of sweeping edicts against several Latin practices. Latin bishops have responded in kind, and while leaders have allowed the matter to blow over, the simmering anger between both sides remains sharp and clear.;;;;;;;;;;;;;x
EVTOPTA_Plus_2282;The Eucharist uses leavened bread -- only!;;;;;;;;;;;;;x
EVTOPTB_Plus_2282;The Eucharist uses unleavened bread -- only!;;;;;;;;;;;;;x
EVTOPTC_Plus_2282;All this over bread? Seriously?;;;;;;;;;;;;;x
EVTNAME_Plus_2283;The Wicked [Root.PrimaryTitle.GetRulerTitle];;;;;;;;;;;;;x
