#CODE;ENGLISH;FRENCH;GERMAN;;SPANISH;;;;;;;;;x
EVTTOOLTIP_ENFLAME_DISCOVER;Realizes that you were behind the attempt;Realizes that you were behind the attempt;Realizes that you were behind the attempt;;Realizes that you were behind the attempt;;;;;;;;;
EVTTOOLTIP_ENFLAME_FAIL;The attempt to enflame the rivalry fails, but you are not revealed\n;The attempt to enflame the rivalry fails, but you are not revealed\n;The attempt to enflame the rivalry fails, but you are not revealed\n;;The attempt to enflame the rivalry fails, but you are not revealed\n;;;;;;;;;
EVTTOOLTIP_ENFLAME_SUCCEED;The attempt to enflame the rivalry succeeds\n;The attempt to enflame the rivalry succeeds\n;The attempt to enflame the rivalry succeeds\n;;The attempt to enflame the rivalry succeeds\n;;;;;;;;;
EVTTOOLTIP_ENFLAME_REVEAL;The attempt to enflame the rivalry fails, and your role is revealed to one or both parties\n;The attempt to enflame the rivalry fails, and your role is revealed to one or both parties\n;The attempt to enflame the rivalry fails, and your role is revealed to one or both parties\n;;The attempt to enflame the rivalry fails, and your role is revealed to one or both parties\n;;;;;;;;;
EVTTOOLTIP_REDUCE_FAIL;Relations with [target_spy_on.GetHerHis] liege are unaffected\n;Relations with [target_spy_on.GetHerHis] liege are unaffected\n;Relations with [target_spy_on.GetHerHis] liege are unaffected\n;;Relations with [target_spy_on.GetHerHis] liege are unaffected\n;;;;;;;;;
EVTTOOLTIP_REDUCE_REVEAL;Relations with [target_spy_on.GetHerHis] liege are unaffected, and either party may discover your attempt\n;Relations with [target_spy_on.GetHerHis] liege are unaffected, and either party may discover your attempt\n;Relations with [target_spy_on.GetHerHis] liege are unaffected, and either party may discover your attempt\n;;Relations with [target_spy_on.GetHerHis] liege are unaffected, and either party may discover your attempt\n;;;;;;;;;
EVTTOOLTIP_REDUCE_SUCCEED;Relations with [target_spy_on.GetHerHis] liege are worsened\n;Relations with [target_spy_on.GetHerHis] liege are worsened\n;Relations with [target_spy_on.GetHerHis] liege are worsened\n;;Relations with [target_spy_on.GetHerHis] liege are worsened\n;;;;;;;;;
EVTTOOLTIP_FemRule_111;I am ready to be acknowledged as my father's legitimate heir.;I am ready to be acknowledged as my father's legitimate heir.;I am ready to be acknowledged as my father's legitimate heir.;;I am ready to be acknowledged as my father's legitimate heir.;;;;;;;;;x
EVTTOOLTIP_FemRule_140;Tell your liege of your retirement.;Tell your liege of your retirement.;Tell your liege of your retirement.;;Tell your liege of your retirement.;;;;;;;;;x
EVTTOOLTIP_FemRule_145;Request to be your lady's champion.;Request to be your lady's champion.;Request to be your lady's champion.;;Request to be your lady's champion.;;;;;;;;;x
EVTTOOLTIP_FemRule_146;Your champion hears of the request.;Your champion hears of the request.;Your champion hears of the request.;;Your champion hears of the request.;;;;;;;;;x
EVTTOOLTIP_INFORM_PLOTTER;Send word that your information can be used in the plot against [target_spy_on.GetTitledFirstName];Send word that your information can be used in the plot against [target_spy_on.GetTitledFirstName];Send word that your information can be used in the plot against [target_spy_on.GetTitledFirstName];;Send word that your information can be used in the plot against [target_spy_on.GetTitledFirstName];;;;;;;;;x
EVTTOOLTIP_INFORM_TARGET;Send word of the plot against [From.PlotTarget.GetHerHim];Send word of the plot against [From.PlotTarget.GetHerHim];Send word of the plot against [From.PlotTarget.GetHerHim];;Send word of the plot against [From.PlotTarget.GetHerHim];;;;;;;;;x
EVTTOOLTIP_SOA_1032;[This.GetTitledFirstName] joins the [join_holy_order.GetName].;[This.GetTitledFirstName] joins the [join_holy_order.GetName].;[This.GetTitledFirstName] joins the [join_holy_order.GetName].;;[This.GetTitledFirstName] joins the [join_holy_order.GetName].;;;;;;;;;x
EVTTOOLTIP_STOP_SPYING;Cease all spying attempts against [target_spy_on.GetTitledName]\n;Cease all spying attempts against [target_spy_on.GetTitledName]\n;Cease all spying attempts against [target_spy_on.GetTitledName]\n;;Cease all spying attempts against [target_spy_on.GetTitledName]\n;;;;;;;;;x
EVTTOOLWAYfamilyhatesyou;is imprisoned by the enemy and any family members left behind in the castle aren't too happy about it\n;est emprisonné par l'ennemi et l'éventuelle famille restée au castel ne s'en réjouit guère\n;is imprisoned by the enemy and any family members left behind in the castle aren't too happy about it\n;;is imprisoned by the enemy and any family members left behind in the castle aren't too happy about it\n;;;;;;;;;x
EVTTOOLTIP_WOL1107;[From.GetFirstName] and [This.GetTitledFirstNameNoRegnal] break off their love affair;[From.GetFirstName] and [This.GetTitledFirstNameNoRegnal] break off their love affair;[From.GetFirstName] and [This.GetTitledFirstNameNoRegnal] break off their love affair;;[From.GetFirstName] and [This.GetTitledFirstNameNoRegnal] break off their love affair;;;;;;;;;x
EXECUTE_INFIDEL;Arrange for a public execution;Arrange for a public execution;Arrange for a public execution;;Arrange for a public execution;;;;;;;;;x
failed_change_nick;Fails to change the nickname\n;Fails to change the nickname\n;Fails to change the nickname\n;;Fails to change the nickname\n;;;;;;;;;x
FEMALE_CAN_FIGHT_IN_TOURNAMENT;Can fight in own tournament\n;Can fight in own tournament\n;Can fight in own tournament\n;;Can fight in own tournament\n;;;;;;;;;x
FIND_TEMPLE_BUILDER;Find a suitable courtier to build the temple\n;Find a suitable courtier to build the temple\n;Find a suitable courtier to build the temple\n;;Find a suitable courtier to build the temple\n;;;;;;;;;x
GAINS_WESTERN_MIDDLE_FRANCIA;gains all vassals in Bar, Flanders, Brabant, Burgundy, and Dauphine\n;gains all vassals in Bar, Flanders, Brabant, Burgundy, and Dauphine\n;gains all vassals in Bar, Flanders, Brabant, Burgundy, and Dauphine\n;;gains all vassals in Bar, Flanders, Brabant, Burgundy, and Dauphine\n;;;;;;;x
GAINS_FRISIA;gains all vassals in Gelre and Holland\n;gains all vassals in Gelre and Holland\n;gains all vassals in Gelre and Holland\n;;gains all vassals in Gelre and Holland\n;;;;;;;x
germany_formed;Germany/East Francia has been formed\n;Germany/East Francia has been formed\n;Germany/East Francia has been formed\n;;Germany/East Francia has been formed\n;;;;;;;x
GET_HURUFI_OMENS;Begin studying the Qur'an to look for omens...;Begin studying the Qur'an to look for omens...;Begin studying the Qur'an to look for omens...;;Begin studying the Qur'an to look for omens...;;;;;;;x
GETS_HOLY_WAR_TIMER_5_YEARS;Will be restricted from further holy wars for §Y5 years§!\n;Will be restricted from further holy wars for §Y5 years§!\n;Will be restricted from further holy wars for §Y5 years§!\n;;Will be restricted from further holy wars for §Y5 years§!\n;;;;;;;;;x
GETS_HOLY_WAR_TIMER_10_YEARS;Will be restricted from further holy wars for §Y10 years§!\n;Will be restricted from further holy wars for §Y10 years§!\n;Will be restricted from further holy wars for §Y10 years§!\n;;Will be restricted from further holy wars for §Y10 years§!\n;;;;;;;;;x
GO_ASSIST_HER;Go to assist your [GetFromRelation], and do whatever she needs;Go to assist your [GetFromRelation], and do whatever she needs;Go to assist your [GetFromRelation], and do whatever she needs;;Go to assist your [GetFromRelation], and do whatever she needs;;;;;;;;;x
GO_ASSIST_HER_WITH_TROOPS;Bring a large retinue to [From.Capital.GetName] and protect her;Bring a large retinue to [From.Capital.GetName] and protect her;Bring a large retinue to [From.Capital.GetName] and protect her;;Bring a large retinue to [From.Capital.GetName] and protect her;;;;;;;;;x
GRANTED_DUCHY_ALSACE;is granted the Duchy of Alsace\n;is granted the Duchy of Alsace\n;is granted the Duchy of Alsace\n;;is granted the Duchy of Alsace\n;;;;;;;x
HAS_100_LEVIES;Has at least 100 levies available\n;Has at least 100 levies available\n;Has at least 100 levies available\n;;Has at least 100 levies available\n;;;;;;;x
HAS_ANOTHER_ELIGIBLE_HEIR;Has a suitable adult child or grandchild pretender\n;Has a suitable adult child or grandchild pretender\n;Has a suitable adult child or grandchild pretender\n;;Has a suitable adult child or grandchild pretender\n;;;;;;;;;x
HAS_BISHOP_WILLING_TO_CORONATE;Has realm priest able to perform coronation\n;Has realm priest able to perform coronation\n;Has realm priest able to perform coronation\n;;Has realm priest able to perform coronation\n;;;;;;;;;x
HAS_CHAMPION_AVAILABLE;Has champion available\n;Has champion available\n;Has champion available\n;;Has champion available\n;;;;;;;;;x
HAS_COURT_DRUID_AVAILABLE;Has court druid available\n;Has court druid available\n;Has court druid available\n;;Has court druid available\n;;;;;;;;;x
HAS_CROWNLAW_TITLE;§Y[Root.GetFullName]§! has a crown law title\n;§Y[Root.GetFullName]§! has a crown law title\n;§Y[Root.GetFullName]§! has a crown law title\n;;§Y[Root.GetFullName]§! has a crown law title\n;;;;;;;;;x
HAS_BARD_AVAILABLE;Has court bard available\n;Has court bard available\n;Has court bard available\n;;Has court bard available\n;;;;;;;;;x
HAS_NO_CIVIL_WAR;Not currently in a civil war\n;Not currently in a civil war\n;Not currently in a civil war\n;;Not currently in a civil war\n;;;;;;;;;x
HAS_NO_CROWNLAW_TITLE;§Y[Root.GetFullName]§! has no crown law title\n;§Y[Root.GetFullName]§! has no crown law title\n;§Y[Root.GetFullName]§! has no crown law title\n;;§Y[Root.GetFullName]§! has no crown law title\n;;;;;;;;;x
HAS_POSSIBLE_DYNASTY_HEIR;Has a child of your dynasty who can inherit your titles\n;Has a child of your dynasty who can inherit your titles\n;Has a child of your dynasty who can inherit your titles\n;;Has a child of your dynasty who can inherit your titles\n;;;;;;;;;x
HAS_POSSIBLE_TEMPLE_BUILDER;Has a courtier who might be willing to build a temple\n;Has a courtier who might be willing to build a temple\n;Has a courtier who might be willing to build a temple\n;;Has a courtier who might be willing to build a temple\n;;;;;;;;;x
HAS_RECENTLY_CORRUPTED_COUNCILLOR;Has corrupted a member of the council within the last year\n;Has corrupted a member of the council within the last year\n;Has corrupted a member of the council within the last year\n;;Has corrupted a member of the council within the last year\n;;;;;;;;;x
HAS_SIZE_EMPIRE;Realm has at least §Y150§! holdings or §Y50§! provinces\n;Realm has at least §Y150§! holdings or §Y50§! provinces\n;Realm has at least §Y150§! holdings or §Y50§! provinces\n;;Realm has at least §Y150§! holdings or §Y50§! provinces\n;;;;;;;;;x
HAS_TWO_DUKE_TITLES;Has at least two non-titular duke titles\n;Has at least two non-titular duke titles\n;Has at least two non-titular duke titles\n;;Has at least two non-titular duke titles\n;;;;;;;;;x
HAS_TWO_KING_TITLES;Has at least two non-titular kingdom titles\n;Has at least two non-titular kingdom titles\n;Has at least two non-titular kingdom titles\n;;Has at least two non-titular kingdom titles\n;;;;;;;;;x
HAS_THREE_MANICHEAN_VASSALS_AVAILABLE;Has at least three Manicheaen vassals available\n;Has at least three Manicheaen vassals available\n;Has at least three Manicheaen vassals available\n;;Has at least three Manicheaen vassals available\n;;;;;;;;;x
HAS_THREE_NORSE_VASSALS_AVAILABLE;Has at least three Norse vassals available who are not at war\n;Has at least three Norse vassals available who are not at war\n;Has at least three Norse vassals available who are not at war\n;;Has at least three Norse vassals available who are not at war\n;;;;;;;;;x
HAS_THREE_YAZIDI_VASSALS_AVAILABLE;Has at least three Yazidi vassals who can attend\n;Has at least three Yazidi vassals who can attend\n;Has at least three Yazidi vassals who can attend\n;;Has at least three Yazidi vassals who can attend\n;;;;;;;;;x
HELLENIC_PRIEST_HOLDS_HOLY_SITE;A suitable [Root.Religion.GetPriestTitle] holds a [Root.Religion.GetName] holy site\n;A suitable [Root.Religion.GetPriestTitle] holds a [Root.Religion.GetName] holy site\n;A suitable [Root.Religion.GetPriestTitle] holds a [Root.Religion.GetName] holy site\n;;A suitable [Root.Religion.GetPriestTitle] holds a [Root.Religion.GetName] holy site\n;;;;;;;;;x
HELPED_WIN_REVOLT;Helped win Revolt\n;Helped win Revolt\n;Helped win Revolt\n;;Helped win Revolt\n;;;;;;;;;x
HOLY_SITE_ALL_SAME_RELIGION;All §Y[Root.Religion.GetName]§! Holy Sites are held by [Root.Religion.GetName] rulers\n;All §Y[Root.Religion.GetName]§! Holy Sites are held by [Root.Religion.GetName] rulers\n;All §Y[Root.Religion.GetName]§! Holy Sites are held by [Root.Religion.GetName] rulers\n;;All §Y[Root.Religion.GetName]§! Holy Sites are held by [Root.Religion.GetName] rulers\n;;;;;;;;;x
HOLY_WAR_KHARIJITE;Has §Y100.0§! Piety and is §YKharijite§!\n;Has §Y100.0§! Piety and is §YKharijite§!\n;Has §Y100.0§! Piety and is §YKharijite§!\n;;Has §Y100.0§! Piety and is §YKharijite§!\n;;;;;;;;;x
HOLY_WAR_REGULAR;Has §Y100.0§! Piety and has not invoked a §YHoly War§! within the last five years\n;Has §Y100.0§! Piety and has not invoked a §YHoly War§! within the last five years\n;Has §Y100.0§! Piety and has not invoked a §YHoly War§! within the last five years\n;;Has §Y100.0§! Piety and has not invoked a §YHoly War§! within the last five years\n;;;;;;;;;x
HOLY_WAR_SANCTIONED;Holy War sanctioned against §Y[From.GetBestName]§! by [Root.Religion.GetName] religion head\n;Holy War sanctioned against §Y[From.GetBestName]§! by [Root.Religion.GetName] religion head\n;Holy War sanctioned against §Y[From.GetBestName]§! by [Root.Religion.GetName] religion head\n;;Holy War sanctioned against §Y[From.GetBestName]§! by [Root.Religion.GetName] religion head\n;;;;;;;x
HOLYTRUCETOOLTIP;[This.GetTitledFirstName] will be unable to §Ydeclare war§! or §Ybe declared on§! for ten years\n;[This.GetTitledFirstName] sera incapable de §Ydeclarer la guerre§! ou §Yde se faire attaquer§! Pendant dix ans.\n;[This.GetTitledFirstName] will be unable to §Ydeclare war§! or §Ybe declared on§! for ten years\n;;[This.GetTitledFirstName] will be unable to §Ydeclare war§! or §Ybe declared on§! for ten years\n;;;;;;;;x
hre_formed;The Holy Roman Empire has been formed with the pope's consent\n;The Holy Roman Empire has been formed with the pope's consent\n;The Holy Roman Empire has been formed with the pope's consent\n;;The Holy Roman Empire has been formed with the pope's consent\n;;;;;;;;;x
HUNGARY_FORMED;Hungary has been formed by the Magyars\n;Hungary has been formed by the Magyars\n;Hungary has been formed by the Magyars\n;;Hungary has been formed by the Magyars\n;;;;;;;;;x
hunt_bystander_dies;An innocent bystander is killed in your place\n;An innocent bystander is killed in your place\n;An innocent bystander is killed in your place\n;;An innocent bystander is killed in your place\n;;;;;;;;;x
hunt_killed_bear;You kill the bear! Well done!\n;You kill the bear! Well done!\n;You kill the bear! Well done!\n;;You kill the bear! Well done!\n;;;;;;;;;
hunt_killed_boar;You kill the boar! Well done!\n;You kill the boar! Well done!\n;You kill the boar! Well done!\n;;You kill the boar! Well done!\n;;;;;;;;;
hunt_killed_stag;You kill the stag! Well done!\n;You kill the stag! Well done!\n;You kill the stag! Well done!\n;;You kill the stag! Well done!\n;;;;;;;;;
hunt_killed_wolf;You kill a large wolf! Well done!\n;You kill a large wolf! Well done!\n;You kill a large wolf! Well done!\n;;You kill a large wolf! Well done!\n;;;;;;;;;
hunt_plotter_dies;The assassin is killed\n;The assassin is killed\n;The assassin is killed\n;;The assassin is killed\n;;;;;;;;;
HUSBAND_BRIBERY_SUCCESSFUL;Your husband loses his supporters, thus ending his scheme;Your husband loses his supporters, thus ending his scheme;Your husband loses his supporters, thus ending his scheme;;Your husband loses his supporters, thus ending his scheme;;;;;;;x
HUSBAND_BRIBERY_UNSUCCESSFUL;It is not enoughyour husband retains enough supporters to act;It is not enoughyour husband retains enough supporters to act;It is not enoughyour husband retains enough supporters to act;;It is not enoughyour husband retains enough supporters to act;;;;;;;x
HUSBAND_CAMPAIGN_SUCCESSFUL;Your vassals are swayed enough to support your cause;Your vassals are swayed enough to support your cause;Your vassals are swayed enough to support your cause;;Your vassals are swayed enough to support your cause;;;;;;;x
HUSBAND_CAMPAIGN_UNSUCCESSFUL;Your vassals are not moved enough to support you;Your vassals are not moved enough to support you;Your vassals are not moved enough to support you;;Your vassals are not moved enough to support you;;;;;;;x
HUSBAND_INTIMIDATION_SUCCESSFUL;The campaign of intimidation succeeds in stopping your husband;The campaign of intimidation succeeds in stopping your husband;The campaign of intimidation succeeds in stopping your husband;;The campaign of intimidation succeeds in stopping your husband;;;;;;;x
HUSBAND_INTIMIDATION_UNSUCCESSFUL;The campaign of intimidation fails;The campaign of intimidation fails;The campaign of intimidation fails;;The campaign of intimidation fails;;;;;;;x
IMPERIAL_DECADENCE_MINUS_1;§YImperial Decadence§! will be §Greduced§! by 1\n;§YImperial Decadence§! will be §Greduced§! by 1\n;§YImperial Decadence§! will be §Greduced§! by 1\n;;§YImperial Decadence§! will be §Greduced§! by 1\n;;;;;;;x
IMPERIAL_DECADENCE_MINUS_1TO3;§YImperial Decadence§! will be §Greduced§! by 1 to 3\n;§YImperial Decadence§! will be §Greduced§! by 1 to 3\n;§YImperial Decadence§! will be §Greduced§! by 1 to 3\n;;§YImperial Decadence§! will be §Greduced§! by 1 to 3\n;;;;;;;x
IMPERIAL_DECADENCE_MINUS_2;§YImperial Decadence§! will be §Greduced§! by 2\n;§YImperial Decadence§! will be §Greduced§! by 2\n;§YImperial Decadence§! will be §Greduced§! by 2\n;;§YImperial Decadence§! will be §Greduced§! by 2\n;;;;;;;x
IMPERIAL_DECADENCE_MINUS_10;§YImperial Decadence§! will be §Greduced§! by 10\n;§YImperial Decadence§! will be §Greduced§! by 10\n;§YImperial Decadence§! will be §Greduced§! by 10\n;;§YImperial Decadence§! will be §Greduced§! by 10\n;;;;;;;x
IMPERIAL_DECADENCE_PLUS_1;§YImperial Decadence§! will be §Rincreased§! by 1\n;§YImperial Decadence§! will be §Rincreased§! by 1\n;§YImperial Decadence§! will be §Rincreased§! by 1\n;;§YImperial Decadence§! will be §Rincreased§! by 1\n;;;;;;;x
IMPERIAL_DECADENCE_PLUS_1TO2;§YImperial Decadence§! will be §Rincreased§! by 1 to 2\n;§YImperial Decadence§! will be §Rincreased§! by 1 to 2\n;§YImperial Decadence§! will be §Rincreased§! by 1 to 2\n;;§YImperial Decadence§! will be §Rincreased§! by 1 to 2\n;;;;;;;x
IMPERIAL_DECADENCE_PLUS_1TO3;§YImperial Decadence§! will be §Rincreased§! by 1 to 3\n;§YImperial Decadence§! will be §Rincreased§! by 1 to 3\n;§YImperial Decadence§! will be §Rincreased§! by 1 to 3\n;;§YImperial Decadence§! will be §Rincreased§! by 1 to 3\n;;;;;;;x
IMPERIAL_DECADENCE_PLUS_2;§YImperial Decadence§! will be §Rincreased§! by 2\n;§YImperial Decadence§! will be §Rincreased§! by 2\n;§YImperial Decadence§! will be §Rincreased§! by 2\n;;§YImperial Decadence§! will be §Rincreased§! by 2\n;;;;;;;x
IMPERIAL_DECADENCE_PLUS_2TO4;§YImperial Decadence§! will be §Rincreased§! by 2 to 4\n;§YImperial Decadence§! will be §Rincreased§! by 2 to 4\n;§YImperial Decadence§! will be §Rincreased§! by 2 to 4\n;;§YImperial Decadence§! will be §Rincreased§! by 2 to 4\n;;;;;;;x
IMPERIAL_DECADENCE_PLUS_3TO5;§YImperial Decadence§! will be §Rincreased§! by 3 to 5\n;§YImperial Decadence§! will be §Rincreased§! by 3 to 5\n;§YImperial Decadence§! will be §Rincreased§! by 3 to 5\n;;§YImperial Decadence§! will be §Rincreased§! by 3 to 5\n;;;;;;;x
IMPERIAL_DEC_UNDER_10;§YImperial Decadence§! is under 10\n;§YImperial Decadence§! is under 10\n;§YImperial Decadence§! is under 10\n;;§YImperial Decadence§! is under 10\n;;;;;;;;;x
IMPRISON_IF_REFUSE;     You will be able to imprison [This.GetHerHim] if [This.GetSheHe] refuses!\n;     You will be able to imprison [This.GetHerHim] if [This.GetSheHe] refuses!\n;     You will be able to imprison [This.GetHerHim] if [This.GetSheHe] refuses!\n;;     You will be able to imprison [This.GetHerHim] if [This.GetSheHe] refuses!\n;;;;;;;;;x
IN_COMMAND_TOOLTIP;In command of an army while at war\n;In command of an army while at war\n;In command of an army while at war\n;;In command of an army while at war\n;;;;;;;;;x
INCREASESEPARATISM;Becomes §Rmore§! inclined towards separatism\n;Devient §Rplus§! enclin au séparatisme\n;Becomes §Rmore§! inclined towards separatism\n;;Becomes §Rmore§! inclined towards separatism\n;;;;;;;;;x
INCITE_INFORM_LIEGES;Learns of your involvement in the plot;Learns of your involvement in the plot;Learns of your involvement in the plot;;Learns of your involvement in the plot;;;;;;;;;x
INCITE_REVOLT_DISCOVERED;Attempt to incite unrest in [Root.Capital.County.GetName] fails and is discovered\n;Attempt to incite unrest in [Root.Capital.County.GetName] fails and is discovered\n;Attempt to incite unrest in [Root.Capital.County.GetName] fails and is discovered\n;;Attempt to incite unrest in [Root.Capital.County.GetName] fails and is discovered\n;;;;;;;;;x
INCITE_REVOLT_FAILURE;Attempt to incite unrest in [Root.Capital.County.GetName] fails but is not discovered\n;Attempt to incite unrest in [Root.Capital.County.GetName] fails but is not discovered\n;Attempt to incite unrest in [Root.Capital.County.GetName] fails but is not discovered\n;;Attempt to incite unrest in [Root.Capital.County.GetName] fails but is not discovered\n;;;;;;;;;x
INCITE_REVOLT_SUCCESS;Attempt to incite unrest in [Root.Capital.County.GetName] succeeds\n;Attempt to incite unrest in [Root.Capital.County.GetName] succeeds\n;Attempt to incite unrest in [Root.Capital.County.GetName] succeeds\n;;Attempt to incite unrest in [Root.Capital.County.GetName] succeeds\n;;;;;;;;;x
INFORM_FACTION_LEADER;Tell [This.GetHerHim] of [FromFrom.GetTitledFirstName]'s visit;Tell [This.GetHerHim] of [FromFrom.GetTitledFirstName]'s visit;Tell [This.GetHerHim] of [FromFrom.GetTitledFirstName]'s visit;;Tell [This.GetHerHim] of [FromFrom.GetTitledFirstName]'s visit;;;;;;;;;x
INFORM_LIEGE_BUILD_CITY;Inform [Root.Liege.GetHerHim] of the chance to build a city in [Root.Location.GetName];Inform [Root.Liege.GetHerHim] of the chance to build a city in [Root.Location.GetName];Inform [Root.Liege.GetHerHim] of the chance to build a city in [Root.Location.GetName];;Inform [Root.Liege.GetHerHim] of the chance to build a city in [Root.Location.GetName];;;;;;;;;x
INFORM_LIEGE_PLOT;Quietly inform [This.GetHerHim] of the danger [This.GetSheHe] is in...;Quietly inform [This.GetHerHim] of the danger [This.GetSheHe] is in...;Quietly inform [This.GetHerHim] of the danger [This.GetSheHe] is in...;;Quietly inform [This.GetHerHim] of the danger [This.GetSheHe] is in...;;;;;;;;;x
IS_ABROAD_TOOLTIP;Is currently abroad\n;Is currently abroad\n;Is currently abroad\n;;Is currently abroad\n;;;;;;;;;x
IS_INFORMED;Is informed of your decision;Is informed of your decision;Is informed of your decision;;Is informed of your decision;;;;;;;;;x
IS_RULER_PIETY_100;§Y[Root.GetBestName]§! is a ruler and you have §Y100.0§! Piety\n;§Y[Root.GetBestName]§! is a ruler and you have §Y100.0§! Piety\n;§Y[Root.GetBestName]§! is a ruler and you have §Y100.0§! Piety\n;;§Y[Root.GetBestName]§! is a ruler and you have §Y100.0§! Piety\n;;;;;;;;;x
IS_SUCCESSION_CANDIDATE;is a candidate for succession\n;is a candidate for succession\n;is a candidate for succession\n;;is a candidate for succession\n;;;;;;;;;
ISRAEL_HAS_BEEN_MADE;Israel has already been created via the decision\n;Israel has already been created via the decision\n;Israel has already been created via the decision\n;;Israel has already been created via the decision\n;;;;;;;;;x
KIDNAP_DECIDE;Will be forced to decide whether to kill you;Will be forced to decide whether to kill you;Will be forced to decide whether to kill you;;Will be forced to decide whether to kill you;;;;;;;;;x
KIDNAP_DEMAND_TITLE;Demand that [demanded_title.GetName] be turned over to you, or face the consequences;Demand that [demanded_title.GetName] be turned over to you, or face the consequences;Demand that [demanded_title.GetName] be turned over to you, or face the consequences;;Demand that [demanded_title.GetName] be turned over to you, or face the consequences;;;;;;;;;x
KIDNAP_DEMAND_VASSAL;Demand that [demanded_vassal.GetTitledFirstNameNoRegnal] be turned over to you, or face the consequences;Demand that [demanded_vassal.GetTitledFirstNameNoRegnal] be turned over to you, or face the consequences;Demand that [demanded_vassal.GetTitledFirstNameNoRegnal] be turned over to you, or face the consequences;;Demand that [demanded_vassal.GetTitledFirstNameNoRegnal] be turned over to you, or face the consequences;;;;;;;;;x
KIDNAP_IS_SET_FREE;You will be set free\n;You will be set free\n;You will be set free\n;;You will be set free\n;;;;;;;;;x
KIDNAP_MURDER_DISCOVERED;The murder is discovered by [kidnap_victim.GetTitledFirstNameNoRegnal]'s spymaster;The murder is discovered by [kidnap_victim.GetTitledFirstNameNoRegnal]'s spymaster;The murder is discovered by [kidnap_victim.GetTitledFirstNameNoRegnal]'s spymaster;;The murder is discovered by [kidnap_victim.GetTitledFirstNameNoRegnal]'s spymaster;;;;;;;;;x
