#CODE;ENGLISH;FRENCH;GERMAN;;SPANISH;;;;;;;;;x

GERMAN_CULTURES_TRIGGER;Has any German culture\n;;;;;;;;;;;;;x
LATE_GERMAN_CULTURES_TRIGGER;Has Austrian or Low Prussian culture\n;;;;;;;;;;;;;x
POTENTIAL_LATE_GERMAN_CULTURES_TRIGGER;Has Saxon or Bavarian culture\n;;;;;;;;;;;;;x
IS_ITALIAN_TRIGGER;Has any Italian culture\n;;;;;;;;;;;;;x

HAS_CROWNED_TRAIT;Has been coronated.\n;;;;;;;;;;;;;x
HAS_HIGH_CROWNED_TRAIT;Is Strong Basileus, or was crowned by the Pope, religious head, or a high-ranking priest.\n;;;;;;;;;;;;;x

IN_COMMAND_TOOLTIP;In command of an army while at war\n;;;;;;;;;;;;;x