#CODE;ENGLISH;FRENCH;GERMAN;;SPANISH;;;;;;;;;x
KIDNAP_MURDER_DISCOVERED2;The murder is discovered by [kidnap_victim.Liege.GetTitledFirstNameNoRegnal]'s spymaster;The murder is discovered by [kidnap_victim.Liege.GetTitledFirstNameNoRegnal]'s spymaster;The murder is discovered by [kidnap_victim.Liege.GetTitledFirstNameNoRegnal]'s spymaster;;The murder is discovered by [kidnap_victim.Liege.GetTitledFirstNameNoRegnal]'s spymaster;;;;;;;;;x
KIDNAP_MURDER_NOT_DISCOVERED;No one discovers who murdered [kidnap_victim.GetTitledFirstNameNoRegnal]\n;No one discovers who murdered [kidnap_victim.GetTitledFirstNameNoRegnal]\n;No one discovers who murdered [kidnap_victim.GetTitledFirstNameNoRegnal]\n;;No one discovers who murdered [kidnap_victim.GetTitledFirstNameNoRegnal]\n;;;;;;;;;x
KIDNAP_RELEASED;Will be set free--and will be very angry!;Will be set free--and will be very angry!;Will be set free--and will be very angry!;;Will be set free--and will be very angry!;;;;;;;;;x
learns_disinheritance;Receives word of their disinheritance\n;Receives word of their disinheritance\n;Receives word of their disinheritance\n;;Receives word of their disinheritance\n;;;;;;;;;x
learns_reconciliation;Learns of the intended reconciliation\n;Learns of the intended reconciliation\n;Learns of the intended reconciliation\n;;Learns of the intended reconciliation\n;;;;;;;;;x
legitimize_him;Declare [This.GetHerHim] your legitimate child;Declare [This.GetHerHim] your legitimate child;Declare [This.GetHerHim] your legitimate child;;Declare [This.GetHerHim] your legitimate child;;;;;;;;;x
let_the_duel_begin;Allow them to duel before the court!\n;Allow them to duel before the court!\n;Allow them to duel before the court!\n;;Allow them to duel before the court!\n;;;;;;;;;x
LIBERATION_TOOLTIP;will usurp all titles in the §Y[Prev.GetFullName]§! held by §Y[From.GetTitledName]§! or any vassal who is [From.Culture.GetName], not of the same culture group, or whose capital is not in the [Prev.GetFullName]. All remaining vassals will either be vassalized or, if they are not of a lower tier, their titles will be usurped.\n;will usurp all titles in the §Y[Prev.GetFullName]§! held by §Y[From.GetTitledName]§! or any vassal who is [From.Culture.GetName], not of the same culture group, or whose capital is not in the [Prev.GetFullName]. All remaining vassals will either be vassalized or, if they are not of a lower tier, their titles will be usurped.\n;will usurp all titles in the §Y[Prev.GetFullName]§! held by §Y[From.GetTitledName]§! or any vassal who is [From.Culture.GetName], not of the same culture group, or whose capital is not in the [Prev.GetFullName]. All remaining vassals will either be vassalized or, if they are not of a lower tier, their titles will be usurped.\n;;will usurp all titles in the §Y[Prev.GetFullName]§! held by §Y[From.GetTitledName]§! or any vassal who is [From.Culture.GetName], not of the same culture group, or whose capital is not in the [Prev.GetFullName]. All remaining vassals will either be vassalized or, if they are not of a lower tier, their titles will be usurped.\n;;;;;;;;;x
LIBERATION_TOOLTIP2;will gain the §Y[Prev.GetFullName]§! if [This.GetSheHe] owns at least five counties.\n;will gain the §Y[Prev.GetFullName]§! if [This.GetSheHe] owns at least five counties.\n;will gain the §Y[Prev.GetFullName]§! if [This.GetSheHe] owns at least five counties.\n;;will gain the §Y[Prev.GetFullName]§! if [This.GetSheHe] owns at least five counties.\n;;;;;;;;;x
LIBERATION_TOOLTIP3;§Y[This.GetTitledName]§! will be vassalized to §Y[Root.GetTitledFirstNameNoRegnal]§! if [This.GetSheHe] is lower tier.\n;§Y[This.GetTitledName]§! will be vassalized to §Y[Root.GetTitledFirstNameNoRegnal]§! if [This.GetSheHe] is lower tier.\n;§Y[This.GetTitledName]§! will be vassalized to §Y[Root.GetTitledFirstNameNoRegnal]§! if [This.GetSheHe] is lower tier.\n;;§Y[This.GetTitledName]§! will be vassalized to §Y[Root.GetTitledFirstNameNoRegnal]§! if [This.GetSheHe] is lower tier.\n;;;;;;;;;x
LIBERATION_TOOLTIP4;will be vassalized to §Y[Root.GetTitledFirstNameNoRegnal]§! if [This.GetSheHe] is lower tier.\n;will be vassalized to §Y[Root.GetTitledFirstNameNoRegnal]§! if [This.GetSheHe] is lower tier.\n;will be vassalized to §Y[Root.GetTitledFirstNameNoRegnal]§! if [This.GetSheHe] is lower tier.\n;;will be vassalized to §Y[Root.GetTitledFirstNameNoRegnal]§! if [This.GetSheHe] is lower tier.\n;;;;;;;;;x
LOOKING_FOR_SYMPATHETIC_LORD;Look for a sympathetic court to move to\n;Look for a sympathetic court to move to\n;Look for a sympathetic court to move to\n;;Look for a sympathetic court to move to\n;;;;;;;;;
lover_at_coronation;berate [This.GetHerHim] for embarrassing you like this;berate [This.GetHerHim] for embarrassing you like this;berate [This.GetHerHim] for embarrassing you like this;;berate [This.GetHerHim] for embarrassing you like this;;;;;;;;;
MAIMED_MAYBE_CAPTURED;Is §YMaimed§! and has a chance of being captured\n;Is §YMaimed§! and has a chance of being captured\n;Is §YMaimed§! and has a chance of being captured\n;;Is §YMaimed§! and has a chance of being captured\n;;;;;;;;;x
make_friend_attempt_tooltip;[Root.GetFirstName] tries to make a friend.;[Root.GetFirstName] essaie de se faire un ami.;[Root.GetFirstName] tries to make a friend.;;[Root.GetFirstName] tries to make a friend.;;;;;;;;;x
make_friend_sad_tooltip;[From.GetTitledFirstName] is refused.;La requeste de [From.GetTitledFirstName] est rejetée.;[From.GetTitledFirstName] is refused.;;[From.GetTitledFirstName] is refused.;;;;;;;;;x
make_friend_success_tooltip;A friendship is formed.;Une amitié s'est créée.;A friendship is formed.;;A friendship is formed.;;;;;;;;;x
MANUALLY_REJOIN_FACTION;NOTE: Pause the game -- you may need to manually rejoin your faction!;NOTE: Pause the game -- you may need to manually rejoin your faction!;NOTE: Pause the game -- you may need to manually rejoin your faction!;;NOTE: Pause the game -- you may need to manually rejoin your faction!;;;;;;;;;x
MARSHAL_PROV_UNFLAGGED;[Root.job_marshal.Location.GetName] has not had a banner raised\n;[Root.job_marshal.Location.GetName] has not had a banner raised\n;[Root.job_marshal.Location.GetName] has not had a banner raised\n;;[Root.job_marshal.Location.GetName] has not had a banner raised\n;;;;;;;;;x
MARSHAL_PROV_FLAGGED;[Root.job_marshal.Location.GetName] has had a banner raised\n;[Root.job_marshal.Location.GetName] has had a banner raised\n;[Root.job_marshal.Location.GetName] has had a banner raised\n;;[Root.job_marshal.Location.GetName] has had a banner raised\n;;;;;;;;;x
MAY_NOT_BECOME_PRETENDER_AGAIN;May not become the claimant in a pretender faction against §Y[From.GetTitledName]§!'s titles ever again.;May not become the claimant in a pretender faction against §Y[From.GetTitledName]§!'s titles ever again.;May not become the claimant in a pretender faction against §Y[From.GetTitledName]§!'s titles ever again.;;May not become the claimant in a pretender faction against §Y[From.GetTitledName]§!'s titles ever again.;;;;;;;;;x
med_high_max_crownlaw_req;Medium, High or Maximum Crown Law;Autorité de la Couronne Moyenne, Haute ou Maximale;;;;;;;;;;;;x
MEN_ARE_ANGERED;The [Root.Culture.GetName] warriors are angered\n;The [Root.Culture.GetName] warriors are angered\n;The [Root.Culture.GetName] warriors are angered\n;;The [Root.Culture.GetName] warriors are angered\n;;;;;;;;;x
MEN_ARE_PLEASED;The [Root.Culture.GetName] warriors are pleased\n;The [Root.Culture.GetName] warriors are pleased\n;The [Root.Culture.GetName] warriors are pleased\n;;The [Root.Culture.GetName] warriors are pleased\n;;;;;;;;;x
MIAPHYSITE_SCHISM_ENDED;All Miaphysites and their heresies will be merged into the [Root.Religion.GetName] faith\n;All Miaphysites and their heresies will be merged into the [Root.Religion.GetName] faith\n;All Miaphysites and their heresies will be merged into the [Root.Religion.GetName] faith\n;;All Miaphysites and their heresies will be merged into the [Root.Religion.GetName] faith\n;;;;;;;;;x
MOVED_TO_MY_DUNGEON;is moved to your dungeon\n;is moved to your dungeon\n;is moved to your dungeon\n;;is moved to your dungeon\n;;;;;;;;;x
offer_to_become_vassal;Offer to become [From.GetTitledFirstName]'s vassal\n;Offer to become [From.GetTitledFirstName]'s vassal\n;Offer to become [From.GetTitledFirstName]'s vassal\n;;Offer to become [From.GetTitledFirstName]'s vassal\n;;;;;;;;;x
ORTHODOX_SCHISM_ENDED;All Orthodox Christians and heresies will be merged with the [Root.Religion.GetName] faith\n;All Orthodox Christians and heresies will be merged with the [Root.Religion.GetName] faith\n;All Orthodox Christians and heresies will be merged with the [Root.Religion.GetName] faith\n;;All Orthodox Christians and heresies will be merged with the [Root.Religion.GetName] faith\n;;;;;;;;;x
NESTORIAN_SCHISM_ENDED;Nestorianism and its heresies will be merged into the [Root.Religion.GetName] faith\n;Nestorianism and its heresies will be merged into the [Root.Religion.GetName] faith\n;Nestorianism and its heresies will be merged into the [Root.Religion.GetName] faith\n;;Nestorianism and its heresies will be merged into the [Root.Religion.GetName] faith\n;;;;;;;;;x
NHV_BEGIN;You will receive instructions on how to auto-distribute titles.\n;You will receive instructions on how to auto-distribute titles.\n;You will receive instructions on how to auto-distribute titles.\n;;You will receive instructions on how to auto-distribute titles.\n;;;;;;;;;x
nhv_barony_dist1;\n\nAll baronies will be distributed except for those in:\n\n;\n\nAll baronies will be distributed except for those in:\n\n;\n\nAll baronies will be distributed except for those in:\n\n;;\n\nAll baronies will be distributed except for those in:\n\n;;;;;;;;;x
nhv_barony_dist2;§GAll holdings§! will be kept\n;§GAll holdings§! will be kept\n;§GAll holdings§! will be kept\n;;§GAll holdings§! will be kept\n;;;;;;;;;x
nhv_barony_dist3;§GAll held barony-tier titles§! will be distributed.\n;§GAll held barony-tier titles§! will be distributed.\n;§GAll held barony-tier titles§! will be distributed.\n;;§GAll held barony-tier titles§! will be distributed.\n;;;;;;;;;x
nhv_county_dist1;All counties and baronies will be distributed except for those in:\n\n;All counties and baronies will be distributed except for those in:\n\n;All counties and baronies will be distributed except for those in:\n\n;;All counties and baronies will be distributed except for those in:\n\n;;;;;;;;;x
nhv_county_dist2;§GOnly the capital holding§! will be kept\n;§GOnly the capital holding§! will be kept\n;§GOnly the capital holding§! will be kept\n;;§GOnly the capital holding§! will be kept\n;;;;;;;;;x
NHV_END_TOOLTIP;Clear all existing banners and clear the distribution decisions.\n;Clear all existing banners and clear the distribution decisions.\n;Clear all existing banners and clear the distribution decisions.\n;;Clear all existing banners and clear the distribution decisions.\n;;;;;;;;;x
NHV_RESTART_TOOLTIP;Regain access to the title distribution decisions.\n;Regain access to the title distribution decisions.\n;Regain access to the title distribution decisions.\n;;Regain access to the title distribution decisions.\n;;;;;;;;;x
NO_NERTHUS_LAST_10_YEARS;the §YJourney of Nerthus§! has not been hold within the last 10 years\n;the §YJourney of Nerthus§! has not been hold within the last 10 years\n;the §YJourney of Nerthus§! has not been hold within the last 10 years\n;;the §YJourney of Nerthus§! has not been hold within the last 10 years\n;;;;;;;;;x
NO_PIETY_COST_HOLY;Will not incur a Piety penalty, as the §Y[Prev.GetFullName]§! contains a [Root.Religion.GetName] holy site\n;Will not incur a Piety penalty, as the §Y[Prev.GetFullName]§! contains a [Root.Religion.GetName] holy site\n;Will not incur a Piety penalty, as the §Y[Prev.GetFullName]§! contains a [Root.Religion.GetName] holy site\n;;Will not incur a Piety penalty, as the §Y[Prev.GetFullName]§! contains a [Root.Religion.GetName] holy site\n;;;;;;;;;x
NO_PIETY_COST_SANCTION;Will not incur a Piety penalty, as Holy War has been sanctioned against §Y[From.GetBestName]§!\n;Will not incur a Piety penalty, as Holy War has been sanctioned against §Y[From.GetBestName]§!\n;Will not incur a Piety penalty, as Holy War has been sanctioned against §Y[From.GetBestName]§!\n;;Will not incur a Piety penalty, as Holy War has been sanctioned against §Y[From.GetBestName]§!\n;;;;;;;;;x
NO_REALM_WAR;No ruler in the §Y[Root.TopLiege.PrimaryTitle.GetFullName]§! is at war\n;No ruler in the §Y[Root.TopLiege.PrimaryTitle.GetFullName]§! is at war\n;No ruler in the §Y[Root.TopLiege.PrimaryTitle.GetFullName]§! is at war\n;;No ruler in the §Y[Root.TopLiege.PrimaryTitle.GetFullName]§! is at war\n;;;;;;;;;x
NO_VASSALS_DISLIKE;No vassal of Duke tier or higher has an opinion of less than 0 towards you\n;No vassal of Duke tier or higher has an opinion of less than 0 towards you\n;No vassal of Duke tier or higher has an opinion of less than 0 towards you\n;;No vassal of Duke tier or higher has an opinion of less than 0 towards you\n;;;;;;;;;x
NO_WAY;No way!;No way!;No way!;;No way!;;;;;;;;;x
NON_RULER_PIETY_50;§Y[Root.GetBestName]§! is NOT a ruler and you have §Y50.0§! Piety\n;§Y[Root.GetBestName]§! is NOT a ruler and you have §Y50.0§! Piety\n;§Y[Root.GetBestName]§! is NOT a ruler and you have §Y50.0§! Piety\n;;§Y[Root.GetBestName]§! is NOT a ruler and you have §Y50.0§! Piety\n;;;;;;;;;x
NOT_AWARE_PLOT;Is not already aware of [Root.GetTitledFirstNameNoRegnal]'s plot against [This.GetHerHim]\n;Is not already aware of [Root.GetTitledFirstNameNoRegnal]'s plot against [This.GetHerHim]\n;Is not already aware of [Root.GetTitledFirstNameNoRegnal]'s plot against [This.GetHerHim]\n;;Is not already aware of [Root.GetTitledFirstNameNoRegnal]'s plot against [This.GetHerHim]\n;;;;;;;;;x
NOT_BUILDING_CITY;Not currently constructing a new city\n;Not currently constructing a new city\n;Not currently constructing a new city\n;;Not currently constructing a new city\n;;;;;;;;;x
NOT_BUILDING_TEMPLE;Not currently constructing a new temple\n;Not currently constructing a new temple\n;Not currently constructing a new temple\n;;Not currently constructing a new temple\n;;;;;;;;;x
NOT_CHALLENGED_LAST_YEAR;Has not challenged the faction leadership within the last year\n;Has not challenged the faction leadership within the last year\n;Has not challenged the faction leadership within the last year\n;;Has not challenged the faction leadership within the last year\n;;;;;;;;;x
NOT_DEPOSED_EMPEROR;Is not the former Carolingian Emperor\n;Is not the former Carolingian Emperor\n;Is not the former Carolingian Emperor\n;;Is not the former Carolingian Emperor\n;;;;;;;;;x
NOT_HEIR_CLAIMED_TITLE;Is not the current heir to the supported claimant's title\n;Is not the current heir to the supported claimant's title\n;Is not the current heir to the supported claimant's title\n;;Is not the current heir to the supported claimant's title\n;;;;;;;;;x
NOT_HIRED_ASSASSIN_LAST_YEAR;Has not hired an assassin within the last year\n;Has not hired an assassin within the last year\n;Has not hired an assassin within the last year\n;;Has not hired an assassin within the last year\n;;;;;;;;;x
NOT_IMPERIAL_GOVERNMENT;Does §RNOT§! have §YImperial Government§! or §YImperial Iqta Government§!\n;Does §RNOT§! have §YImperial Government§! or §YImperial Iqta Government§!\n;Does §RNOT§! have §YImperial Government§! or §YImperial Iqta Government§!\n;;Does §RNOT§! have §YImperial Government§! or §YImperial Iqta Government§!\n;;;;;;;;;x
NOT_LAST_NON_NOMAD_HOLDING;This is not the last non-nomadic holding in the province\n;This is not the last non-nomadic holding in the province\n;This is not the last non-nomadic holding in the province\n;;This is not the last non-nomadic holding in the province\n;;;;;;;;;x
NOT_RECENTLY_ASK_SUPPORT;Has not sought support for [From.GetHerHis] claimant within the last month\n;Has not sought support for [From.GetHerHis] claimant within the last month\n;Has not sought support for [From.GetHerHis] claimant within the last month\n;;Has not sought support for [From.GetHerHis] claimant within the last month\n;;;;;;;;;x
NOT_RECENTLY_LOWER_DECADENCE;Have not lowered Imperial Decadence within the last five years\n;Have not lowered Imperial Decadence within the last five years\n;Have not lowered Imperial Decadence within the last five years\n;;Have not lowered Imperial Decadence within the last five years\n;;;;;;;;;x
NOT_RECENTLY_RAISE_TRIBAL_UNITS;Has not raised tribal units within the last month\n;Has not raised tribal units within the last month\n;Has not raised tribal units within the last month\n;;Has not raised tribal units within the last month\n;;;;;;;;;x
NOT_RECENTLY_RAISE_ZEALOTS;Has not raised zealots within the last month\n;Has not raised zealots within the last month\n;Has not raised zealots within the last month\n;;Has not raised zealots within the last month\n;;;;;;;;;x
NOT_RECENTLY_SPIED;Has not spied on someone within the last year\n;Has not spied on someone within the last year\n;Has not spied on someone within the last year\n;;Has not spied on someone within the last year\n;;;;;;;;;x
NOT_RECENTLY_SPIED_UPON;Has not recently been the target of spying\n;Has not recently been the target of spying\n;Has not recently been the target of spying\n;;Has not recently been the target of spying\n;;;;;;;;;x
NOT_RESTRICTED_BY_LOCKOUT_LAW;§Y[Root.TopLiege.PrimaryTitle.GetFullName]§! does not have §YNo Vassal Kings§! law\n;§Y[Root.TopLiege.PrimaryTitle.GetFullName]§! does not have §YNo Vassal Kings§! law\n;§Y[Root.TopLiege.PrimaryTitle.GetFullName]§! does not have §YNo Vassal Kings§! law\n;;§Y[Root.TopLiege.PrimaryTitle.GetFullName]§! does not have §YNo Vassal Kings§! law\n;;;;;;;;;x
NOT_RIVAL_SUPPORTED_CLAIMANT;Is NOT a Rival of [From.SupportedClaimant.GetBestName]\n;Is NOT a Rival of [From.SupportedClaimant.GetBestName]\n;Is NOT a Rival of [From.SupportedClaimant.GetBestName]\n;;Is NOT a Rival of [From.SupportedClaimant.GetBestName]\n;;;;;;;;;x
NOT_SPIES_RECENTLY_ASSAULTED;Spy network not attacked within last six months\n;Spy network not attacked within last six months\n;Spy network not attacked within last six months\n;;Spy network not attacked within last six months\n;;;;;;;;;x
NOT_STOPPED_PRAYER_LAST_3_YEARS;Have not failed to drive out daemons within last 3 years;Have not failed to drive out daemons within last 3 years;Have not failed to drive out daemons within last 3 years;;Have not failed to drive out daemons within last 3 years;;;;;;;;;x
NOT_VALID_FOR_HOLY_WAR;Target is not valid target for a Holy War\n;Target is not valid target for a Holy War\n;Target is not valid target for a Holy War\n;;Target is not valid target for a Holy War\n;;;;;;;;;x
OFFER_BRIBE;Is offered a bribe in exchange for reversing [This.GetHerHis] decision;Is offered a bribe in exchange for reversing [This.GetHerHis] decision;Is offered a bribe in exchange for reversing [This.GetHerHis] decision;;Is offered a bribe in exchange for reversing [This.GetHerHis] decision;;;;;;;;;x
OFFER_FAVOR;Is offered a Favor in exchange for reversing [This.GetHerHis] decision;Is offered a Favor in exchange for reversing [This.GetHerHis] decision;Is offered a Favor in exchange for reversing [This.GetHerHis] decision;;Is offered a Favor in exchange for reversing [This.GetHerHis] decision;;;;;;;;;x
OFFER_TO_KNEEL;Offer to become [This.GetTitledFirstNameNoRegnal]'s vassal and accept [This.GetHerHis] faith;Offer to become [This.GetTitledFirstNameNoRegnal]'s vassal and accept [This.GetHerHis] faith;Offer to become [This.GetTitledFirstNameNoRegnal]'s vassal and accept [This.GetHerHis] faith;;Offer to become [This.GetTitledFirstNameNoRegnal]'s vassal and accept [This.GetHerHis] faith;;;;;;;;;x
ONE_OTHER_HOLDING_TYPE;There is another holding of this type in the province\n;There is another holding of this type in the province\n;There is another holding of this type in the province\n;;There is another holding of this type in the province\n;;;;;;;;;x
ONE_PROVINCE_FLAGGED;At least one province has been flagged to keep\n;At least one province has been flagged to keep\n;At least one province has been flagged to keep\n;;At least one province has been flagged to keep\n;;;;;;;;;x
OVERTHROW_USURP_TITLES;All non-primary titles of the same tier are usurped by a rebel lord with any claim, if one exists. The primary title is usurped by a rebel lord with a strong claim, if one exists. Failing that, the ruler will abdicate to the pretender most liked by §Y[Root.GetBestName]§!.\n;All non-primary titles of the same tier are usurped by a rebel lord with any claim, if one exists. The primary title is usurped by a rebel lord with a strong claim, if one exists. Failing that, the ruler will abdicate to the pretender most liked by §Y[Root.GetBestName]§!.\n;All non-primary titles of the same tier are usurped by a rebel lord with any claim, if one exists. The primary title is usurped by a rebel lord with a strong claim, if one exists. Failing that, the ruler will abdicate to the pretender most liked by §Y[Root.GetBestName]§!.\n;;All non-primary titles of the same tier are usurped by a rebel lord with any claim, if one exists. The primary title is usurped by a rebel lord with a strong claim, if one exists. Failing that, the ruler will abdicate to the pretender most liked by §Y[Root.GetBestName]§!.\n;;;;;;;;;x
OWNS_MARSHAL_PROV;Owns [Root.job_marshal.Location.GetName]\n;Owns [Root.job_marshal.Location.GetName]\n;Owns [Root.job_marshal.Location.GetName]\n;;Owns [Root.job_marshal.Location.GetName]\n;;;;;;;;;x
PAGAN_SUBJ_ADD_MODIFIER;Will be unable to launch another Pagan Subjugation war (without the Become a King ambition)\n;Will be unable to launch another Pagan Subjugation war (without the Become a King ambition)\n;Will be unable to launch another Pagan Subjugation war (without the Become a King ambition)\n;;Will be unable to launch another Pagan Subjugation war (without the Become a King ambition)\n;;;;;;;;;x
PAGAN_SUBJ_NO_MODIFIER;Will be able to launch further Pagan Subjugation wars\n;Will be able to launch further Pagan Subjugation wars\n;Will be able to launch further Pagan Subjugation wars\n;;Will be able to launch further Pagan Subjugation wars\n;;;;;;;;;x
PAPACY_IS_GREEK;The §YPope of Rome§! has §YGreek Rites§!\n;The §YPope of Rome§! has §YGreek Rites§!\n;The §YPope of Rome§! has §YGreek Rites§!\n;;The §YPope of Rome§! has §YGreek Rites§!\n;;;;;;;;;x
pattern_interaction_deserves_execution;This character deserves execution\n;This character deserves execution\n;This character deserves execution\n;;This character deserves execution\n;;;;;;;;;x
pattern_interaction_not_deserves_execution;This character does not deserve execution\n;This character does not deserve execution\n;This character does not deserve execution\n;;This character does not deserve execution\n;;;;;;;;;x
pattern_interaction_deserves_exile;This character deserves exile\n;This character deserves exile\n;This character deserves exile\n;;This character deserves exile\n;;;;;;;;;x
pattern_interaction_not_deserves_exile;This character does not deserve exile\n;This character does not deserve exile\n;This character does not deserve exile\n;;This character does not deserve exile\n;;;;;;;;;x
pattern_interaction_deserves_imprisonment;This character deserves imprisonment\n;This character deserves imprisonment\n;This character deserves imprisonment\n;;This character deserves imprisonment\n;;;;;;;;;x
pattern_interaction_not_deserves_imprisonment;This character does not deserve imprisonment\n;This character does not deserve imprisonment\n;This character does not deserve imprisonment\n;;This character does not deserve imprisonment\n;;;;;;;;;x
PLOT_LEADER_DOESNT_FIND_OUT;§Y[From.GetBestName]§! does not learn what you've done\n;§Y[From.GetBestName]§! does not learn what you've done\n;§Y[From.GetBestName]§! does not learn what you've done\n;;§Y[From.GetBestName]§! does not learn what you've done\n;;;;;;;;;x
PLOT_LEADER_FINDS_OUT;§Y[From.GetBestName]§! discovers your treachery\n;§Y[From.GetBestName]§! discovers your treachery\n;§Y[From.GetBestName]§! discovers your treachery\n;;§Y[From.GetBestName]§! discovers your treachery\n;;;;;;;;;x
POPE_WOULD_HEAR_REQUEST;The pope would agree to hear your request\n;The pope would agree to hear your request\n;The pope would agree to hear your request\n;;The pope would agree to hear your request\n;;;;;;;;;x
prepare_bema_feast;Begin preparations for the Bema feast!\n;Begin preparations for the Bema feast!\n;Begin preparations for the Bema feast!\n;;Begin preparations for the Bema feast!\n;;;;;;;;;x
preacher_allowed;You allow the preacher to continue [From.GetHerHis] missionary work.\n;You allow the preacher to continue [From.GetHerHis] missionary work.\n;You allow the preacher to continue [From.GetHerHis] missionary work.\n;;You allow the preacher to continue [From.GetHerHis] missionary work.\n;;;;;;;;x
preacher_stays;The [Root.GetLordSpiritualName] will remain in [From.Location.GetName] to preach in secret.\n;The [Root.GetLordSpiritualName] will remain in [From.Location.GetName] to preach in secret.\n;The [Root.GetLordSpiritualName] will remain in [From.Location.GetName] to preach in secret.\n;;The [Root.GetLordSpiritualName] will remain in [From.Location.GetName] to preach in secret.\n;;;;;;;;x
