#CODE;ENGLISH;FRENCH;GERMAN;;SPANISH;;;;;;;;;x,,,,,,,,,,,,,,
abolish_witan_hardrada;Declare yourself the sole King of England;Vous déclarer seul Roi d'Angleterre;Declare yourself the sole King of England;;Declare yourself the sole King of England;;;;;;;;;x,,,,,,,,,,,,,,
abolish_witan_hardrada_desc;With you fully in control of the English lands, you can abolish the Witan and end the Anglo-Saxon hegemony over Anglia once and for all!;Maintenant que vous controslez entièrement les terres anglaises, vous pouvez abolir le Witan et mettre fin à l'hégémonie anglo-saxonne sur Anglia une fois pour toutes !;With you fully in control of the English lands, you can abolish the Witan and end the Anglo-Saxon hegemony over Anglia once and for all!;;With you fully in control of the English lands, you can abolish the Witan and end the Anglo-Saxon hegemony over Anglia once and for all!;;;;;;;;;x,,,,,,,,,,
abolish_witan_william;Declare yourself the sole King of England;Vous décarer seul Roi d'Angleterre;Declare yourself the sole King of England;;Declare yourself the sole King of England;;;;;;;;;x,,,,,,,,,,,,,,
abolish_witan_william_desc;With you fully in control of the English lands, you can abolish the Witan and end the Anglo-Saxon hegemony over Anglia once and for all!;Maintenant que vous controslez entièrement les terres anglaises, vous pouvez abolir le Witan et mettre fin à l'hégémonie anglo-saxonne sur Anglia une fois pour toutes !;With you fully in control of the English lands, you can abolish the Witan and end the Anglo-Saxon hegemony over Anglia once and for all!;;With you fully in control of the English lands, you can abolish the Witan and end the Anglo-Saxon hegemony over Anglia once and for all!;;;;;;;;;x,,,,,,,,,,
austro_hungarian_empire;Austrian Empire;Empire Austro-Hongrois;Österreichisch-Ungarisches Kaiserreich;;Imperio Austro-Húngaro;;;;;;;;;x;;,,,,,,,,,,,,,,
austro_hungarian_empire_desc;This decision will give you the Austrian title.;Cette décision vous donnera le titre austro-hongrois.;Diese Entscheidung gibt Ihnen der Österreichisch-Ungarisches Kaiserreichstitel.;;Esta decisión le dará el título Austro-Húngaro.;;;;;;;;;x;;,,,,,,,,,,,,,,
become_braedralag;Found the Bræðralag;Fonder le Bræðralag;Found the Bræðralag;;Found the Bræðralag;;;;;;;;;,,,,,,,,,,,,,,
borrowed_from_ansar;Owes 300¤ to the Ansar Order;Doit 300¤ à la Confrérie des Bektachis;Schuldet dem Orden der Bektaschi 300¤;;Debe 300¤ a los Ansar;;;;;;;;;x;;,,,,,,,,,,,,,,
borrow_money_ansar;Borrow 300¤ from the Ansar;Emprunter 300¤ aulx Bektachis;Leihen Sie sich 300¤ von den Bektaschi;;Pedir 300¤ prestados a los Ansar;;;;;;;;;x;;,,,,,,,,,,,,,,
borrow_money_ansar_desc;I can borrow money from the Ansar and pay back the same sum at any time. However, while I'm in their debt, the Grand Master can make various requests, like one of my sons joining their ranks.;Je puis emprunter de l'argent aulx Bektachis et rembourser la mesme somme quand bon me semble. Cependant, tant que cette dette existe, le Grand Maistre peut formuler diverses requestes, par exemple demander qu'un de mes fils rejoigne leurs rangs.;Ich kann mir von den Bektaschi Geld leihen und den Betrag zu beliebiger Zeit zurückzahlen. Jedoch kann der Großmeister, während ich in ihrer Schuld stehe, an mich verschiedene Forderungen stellen, z.B. dass einer meiner Söhne dem Orden beitritt.;;Puedo pedir un préstamo a los Ansar y devolverles la misma suma en cualquier momento. Sin embargo, mientras esté en deuda con ellos, el Gran Maestre podrá hacer distintas peticiones, como que uno de mis hijos se una a sus filas.;;;;;;;;;x,,
bring_children_to_court;Summon Children to Court;Convoquer les enfants à la cour;Kinder vor Gericht beordern.;;Summon Children to Court;;;;;;;;;x,,,,,,,,,,,,,,
bring_children_to_court_desc;Some of your children are subjects of a foreign court. Bring them home to [Root.PrimaryTitle.GetName].;Certains de vos enfants sont sujets d'une cour étrangère. Ramenez-les chez eulx à [Root.PrimaryTitle.GetName].;Einige eurer Kinder sind Verdächtige an einem ausländischen Gericht. Bringt sie nach hause an eueren Hof [Root.PrimaryTitle.GetName].;;Some of your children are subjects of a foreign court. Bring them home to [Root.PrimaryTitle.GetName].;;;;;;;;;x,,,,,,,,,,,,,,
bring_out_of_hiding;Call Family out of Hiding;Appeler votre Famille à sortir de leur Cachette;Call Family out of Hiding;;Call Family out of Hiding;;;;;;;;;,,,,,,,,,,,,,,
bring_out_of_hiding_desc;Removes Hidden, Stalwart, or Left At Siege from any of your dynasty or spouses at your location.;Enlève Caché, Féal Partisan, ou Laissé au Siège de n'importe quel membre de votre dynastie ou votre conjointe à votre emplacement.;Removes Hidden, Stalwart, or Left At Siege from any of your dynasty or spouses at your location.;;Removes Hidden, Stalwart, or Left At Siege from any of your dynasty or spouses at your location.;;;;;;;;;,,,,,,
capture_desc;§Y$CLAIMANT$§! can attempt to capture all malicious plotters in the realm of §Y$TARGET$§!.;§Y$CLAIMANT$§! Peut tenter de capturer tous les comploteurs malveillants dans le Royaume de §Y$TARGET$§!.;§Y$CLAIMANT$§! kann versuchen, alle böswilligen Verschwörer im Reich von §Y$TARGET$§! Festzunehmen.;;§Y$CLAIMANT$§! can attempt to capture all malicious plotters in the realm of §Y$TARGET$§!.;;;;;;;;;x;;,,,,,,,,,,,,,
check_notable_persons;Check Friends and Rivals;Voir Amis et Rivaulx;Check Friends and Rivals;;Check Friends and Rivals;;;;;;;;;x,,,,,,,,,,,,,,
check_notable_persons_desc;Show your friends and rivals, if you have them.;Montre vos amis et vos rivaulx, si vous en avez.;Show your friends and rivals, if you have them.;;Show your friends and rivals, if you have them.;;;;;;;;;x,,,,,,,,,,
check_people_tooltip;Friends, Rivals, and Lover.;Amis, Rivaulx et Amant(e).;Friends, Rivals, and Lover.;;Friends, Rivals, and Lover.;;;;;;;;;x,,,,,,,
claim_finnmark;Claim Finnmárku for Norway;Claim Finnmárku for Norway;Claim Finnmárku for Norway;;Claim Finnmárku for Norway;;;;;;;;;x,,,,,,,,,,,,,,
claim_finnmark_desc;The tribal lands of Finnmárku should rightfully be under the de jure rule of the Norwegian crown.;The tribal lands of Finnmárku should rightfully be under the de jure rule of the Norwegian crown.;The tribal lands of Finnmárku should rightfully be under the de jure rule of the Norwegian crown.;;The tribal lands of Finnmárku should rightfully be under the de jure rule of the Norwegian crown.;;;;;;;;;x,,,,,,,,,,,,,,
claim_kola;Claim Kola for Finland;Claim Kola for Finland;Claim Kola for Finland;;Claim Kola for Finland;;;;;;;;;x,,,,,,,,,,,,,,
claim_kola_desc;The tribal lands of Kola should rightfully be under the de jure rule of the Finnish crown.;The tribal lands of Kola should rightfully be under the de jure rule of the Finnish crown.;The tribal lands of Kola should rightfully be under the de jure rule of the Finnish crown.;;The tribal lands of Kola should rightfully be under the de jure rule of the Finnish crown.;;;;;;;;;x,,,,,,,,,,,,,,
claim_sami;Claim Sami for Sweden;Claim Sami for Sweden;Claim Sami for Sweden;;Claim Sami for Sweden;;;;;;;;;x,,,,,,,,,,,,,,
claim_sami_desc;The tribal Sami lands in the north should rightfully be under the de jure rule of the Swedish crown.;The tribal Sami lands in the north should rightfully be under the de jure rule of the Swedish crown.;The tribal Sami lands in the north should rightfully be under the de jure rule of the Swedish crown.;;The tribal Sami lands in the north should rightfully be under the de jure rule of the Swedish crown.;;;;;;;;;x,,,,,,,,,,,,,,
convert_finnmark;Create Duchy of Nordland;Create Duchy of Nordland;Create Duchy of Nordland;;Create Duchy of Nordland;;;;;;;;;x,,,,,,,,,,,,,,
convert_finnmark_desc;Now that we control all of Finnmárku, it should be declared a duchy for the [Root.Culture.GetName] to rule.;Now that we control all of Finnmárku, it should be declared a duchy for the [Root.Culture.GetName] to rule.;Now that we control all of Finnmárku, it should be declared a duchy for the [Root.Culture.GetName] to rule.;;Now that we control all of Finnmárku,it should be declared a duchy for the [Root.Culture.GetName] to rule.;;;;;;;;;x,,,,,,,,,,
convert_sami;Create Duchy of Norrland;Create Duchy of Norrland;Create Duchy of Norrland;;Create Duchy of Norrland;;;;;;;;;x,,,,,,,,,,,,,,
convert_sami_desc;Now that we control all of Sami, it should be declared a duchy for the [Root.Culture.GetName] to rule.;Now that we control all of Sami, it should be declared a duchy for the [Root.Culture.GetName] to rule.;Now that we control all of Sami, it should be declared a duchy for the [Root.Culture.GetName] to rule.;;Now that we control all of Sami,it should be declared a duchy for the [Root.Culture.GetName] to rule.;;;;;;;;;x,,,,,,,,,,
convert_to_capital_culture;Embrace [Root.Capital.Culture.GetName] Culture;Embrasser la culture de [Root.Capital.Culture.GetName];[Root.Capital.Culture.GetName]e Kultur annehmen;;Embrace [Root.Capital.Culture.GetName] Culture;;;;;;;;;x;;,,,,,,,,,,,,,,
convert_to_capital_culture_desc;I am impressed with the language and customs of [Root.Capital.GetName]. I wish I were like that...;Je suis impressioné par la langue et les coutumes de [Root.Capital.GetName]. J'aimerais estre comme eulx...;Ich bin zutiefst beeindruckt von der Sprache und den Traditionen von [Root.Capital.GetName]. Ich wünschte, ich wäre wie sie...;;I am impressed with the language and customs of [Root.Capital.GetName]. I wish I were like that...;;;;;;;;;x;;,,,,,,,,,,,,,
convert_to_capital_religion;Convert to [Root.Capital.Religion.GetName];Se convertir à [Root.Capital.Religion.GetName];Zum [Root.Capital.Religion.GetName]en Glauben Konvertieren;;Convert to [Root.Capital.Religion.GetName];;;;;;;;;x;;,,,,,,,,,,,,,,
convert_to_capital_religion_desc;I am sure the people of [Root.Capital.GetName] would be pleased if we had the same faith...;Je suis susr que le peuple de [Root.Capital.GetName] serait heureulx si nous partagions la mesme foi...;Ich bin sicher, die Menschen von [Root.Capital.GetName] wären erfreut, wenn wir den selben Glauben teilten...;;I am sure the people of [Root.Capital.GetName] would be pleased if we had the same faith...;;;;;;;;;x;;,,,,,,,,,,,,
convert_to_celtic_pagan;Convert to Celtic;Se Convertir à la Religion Celte;Convert to Celtic;;Convert to Celtic;;;;;;;;;x,,,,,,,,,,,,,,
convert_to_celtic_pagan_desc;Convert to the faith of my ancestral forefathers!;Me convertir à la foi de mes ancestres !;Convert to the faith of my ancestral forefathers!;;Convert to the faith of my ancestral forefathers!;;;;;;;;;x,,,,,,,,,,,,,,
convert_to_druidic;Convert to Brythonic;Se Convertir à la Religion Brythonique;Convert to Brythonic;;Convert to Brythonic;;;;;;;;;x,,,,,,,,,,,,,,
convert_to_druidic_desc;Convert to the faith of my ancestral forefathers!;Me convertir à la foi de mes ancestres !;Convert to the faith of my ancestral forefathers!;;Convert to the faith of my ancestral forefathers!;;;;;;;;;x,,,,,,,,,,,,,,
convert_to_hellenic_pagan;Convert to Hellenic;Se Convertir au Hellénisme;Convert to Hellenic;;Convert to Hellenic;;;;;;;;;x,,,,,,,,,,,,,,
convert_to_hellenic_pagan_desc;Convert to the faith of my ancestral forefathers!;Me convertir à la foi de mes ancestres !;Convert to the faith of my ancestral forefathers!;;Convert to the faith of my ancestral forefathers!;;;;;;;;;x,,,,,,,,,,,,,,
convert_to_icelandic;Embrace Icelandic Culture;Embrasser la Culture Islandaise;Embrace Icelandic Culture;;Embrace Icelandic Culture;;;;;;;;;x,,,,,,,,,,,,,,
convert_to_liege_culture;Embrace [Root.Liege.Culture.GetName] Culture;Embrasser la culture de [Root.Liege.Culture.GetName];[Root.Liege.Culture.GetName]e Kultur annehmen;;Embrace [Root.Liege.Culture.GetName] Culture;;;;;;;;;x;;,,,,,,,,,,,,,,
convert_to_liege_culture_desc;I am impressed with the language and customs of [Root.Liege.GetTitledFirstName]. I wish I were like that...;Je suis impressioné par la langue et les coutumes de [Root.Liege.GetTitledFirstName]. J'aimerais estre comme ça...;Ich bin zutiefst beeindruckt von der Sprache und den Traditionen von [Root.Liege.GetTitledFirstName]. Ich wünschte, ich wäre wie er...;;I am impressed with the language and customs of [Root.Liege.GetTitledFirstName]. I wish I were like that...;;;;;;;;;x;;,,,,,,,,,,,,,
convert_to_liege_religion;Convert to [Root.Liege.Religion.GetName];Se convertir à [Root.Liege.Religion.GetName];Zum [Root.Liege.Religion.GetName]en Glauben Konvertieren;;Convert to [Root.Liege.Religion.GetName];;;;;;;;;x;;,,,,,,,,,,,,,,
convert_to_liege_religion_desc;I am sure [Root.Liege.GetTitledFirstName] would be pleased if we had the same faith...;Je suis susr que [Root.Liege.GetTitledFirstName] serait content si nous partagions la mesme foi...;Ich bin sicher, [Root.Liege.GetTitledFirstName] wäre erfreut, wenn wir den selben Glauben teilten...;;I am sure [Root.Liege.GetTitledFirstName] would be pleased if we had the same faith...;;;;;;;;;x;;,,,,,,,,,,,,
convert_to_roman;Embrace Roman Culture;Embrasser la Culture Romaine;Romane Kultur annehmen;;Embrace Roman Culture;;;;;;;;;x,,,,,,,,,,,,,,
convert_to_roman_desc;We have reunited the Roman Empire. It is time to become Roman once more!;Nous avons réunifié l'Empire Romain. Il est temps de redevenir Romain !;;We have reunited the Roman Empire. It is time to become Roman once more!;;;;;;;;;x;,,,,,,,,,,,,,,
convert_to_zoroastrianism;Convert to Zoroastrianism;Se Convertir au Zoroastrisme;Convert to Zoroastrianism;;Convert to Zoroastrianism;;;;;;;;;x,,,,,,,,,,,,,,
convert_to_zoroastrianism_desc;Convert to the faith of my ancestral forefathers!;Me convertir à la foi de mes ancestres !;Convert to the faith of my ancestral forefathers!;;Convert to the faith of my ancestral forefathers!;;;;;;;;;x,,,,,,,,,,,,,,
cornish;Cornish;Cornouaillais;Kornisch;;Cornish;;;;;;;x;;;;,,,,,,,,,,,,,,
coronation;Request Papal Coronation;Demander un Couronnement au Pape;Päpstliche Krönung erbitten;;Request Papal Coronation;;;;;;;;x;;;,,,,,,,,,,,,,,
coronation_desc;Enacting this decision will result in a request to the Pope for a coronation ceremony to be held at Rome in honour of [Root.GetTitledFirstName]. This will allow [Root.GetTitledFirstName] to become crowned and blessed by the Pope and extend your authority as the ruler of the Holy Roman Empire, which further legitimises your rule.;Promulguer cette décision entraisnera l'envoi d'une requeste au Pape, lui demandant d'organiser une cérémonie de couronnement à Rome en l'honneur de [Root.GetTitledFirstName]. Cela autorisera [Root.GetTitledFirstName] à estre couronné et bénit par le Pape et d'accroistre son autorité comme souverain du Saint Empire Romain, ce qui légitimera également votre règne.;Erlass dieser Entscheidung wird einen Antrag an den Papst auf eine Krönungszeremonie richten, die in Rom zu Ehren von [Root.GetTitledFirstName] stattfinden soll. Dies ermöglicht [Root.GetTitledFirstName] durch den Papst gekrönt und gesegnet zu werden und erhöht die Autorität als Herrscher des Heiligen Römischen Reiches.;;Enacting this decision will result in a request to the Pope for a coronation ceremony to be held at Rome in honour of [Root.GetTitledFirstName]. This will allow [Root.GetTitledFirstName] to become crowned and blessed by the Pope and extend your authority as the ruler of the Holy Roman Empire, which further legitimises your rule.;;;;;;;;x;,,,,,,,,,
coronation_rejected;Rejected Coronation;A rejeté le Couronnement;Krönung abgelehnt;;Rejected Coronation;;;;;;;;x;;;,,,,,,,,,,,,,,
create_e_shiite;Become Caliph;Devenir Calife;Werdet Kalif;;Become Caliph;;;;;;;x;;;;,,,,,,,,,,,,,,
create_e_shiite_desc;The Shia Caliphate has fallen, but there is yet hope for the faith. With enough influence and piety we could declare ourselves the heir to the Caliphate and create a new Shia Caliphate.;Le Califat Chiite est tombé, mais il y a désormais un espoir pour la foi. Avec assez d'influence et de piété nous pourrions nous proclamer héritier du Califat et créer un nouveau Califat Chiite.;Das Schiitisches Kalifat ist gefallen, aber es gibt noch Hoffnung für den Glauben. Mit genug Einfluss und Gläubigkeit konnten wir uns als Erbe des Kalifat erklären und ein neues schiitisches Kalifat schaffen.;;The Shia Caliphate has fallen, but there is yet hope for the faith. With enough influence and piety we could declare ourselves the heir to the Caliphate and create a new Shia Caliphate.;;;;;;;x;;;;,,,,,,,,,,
create_e_sunni;Become Caliph;Devenir Calife;Werdet Kalif;;Become Caliph;;;;;;;x;;;;,,,,,,,,,,,,,,
create_e_sunni_desc;The Sunni Caliphate has fallen, but there is yet hope for the faith. With enough influence and piety we could declare ourselves the heir to the Caliphate and create a new Sunni Caliphate.;Le Califat Sunnite est tombé, mais il y a désormais un espoir pour la foi. Avec assez d'influence et de piété nous pourrions nous proclamer héritier du Califat et créer un nouveau Califat Sunnite.;Das Sunnitiche Kalifat ist gefallen, aber es gibt noch Hoffnung für den Glauben. Mit genug Einfluss und Gläubigkeit konnten wir uns als Erbe des Kalifat erklären und ein neues Sunnitiche Kalifat schaffen.;;The Sunni Caliphate has fallen, but there is yet hope for the faith. With enough influence and piety we could declare ourselves the heir to the Caliphate and create a new Sunni Caliphate.;;;;;;;x;;;;,,,,,,,,,,
employ_chancellor;Invite Chancellor to Court;Inviter un Chancelier à la Cour;Kanzler an den Hof laden;;Invite Chancellor to Court;;;;;;;x;;;;,,,,,,,,,,,,,,
employ_chancellor_desc;Invite a promising nobleman to court, to aid with diplomatic affairs.;Inviter un noble prometteur à la Cour, pour vous assister en matière diplomatique.;Laden Sie einen viel versprechenden Adligen in den Rat ein, um bei diplomatischen Angelegenheiten zu helfen.;;Invite a promising nobleman to court, to aid with diplomatic affairs.;;;;;;;x;;;;,,,,,,,,,,
employ_court_jester;Hire a Court Jester;Engager un Bouffon à la cour;Hire a Court Jester;;Hire a Court Jester;;;;;;;;;x,,,,,,,,,,,,,,
employ_court_jester_desc;Hire a promising fool to keep my court entertained.;Engager un bouffon prometteur pour amuser ma cour.;Hire a promising fool to keep my court entertained.;;Hire a promising fool to keep my court entertained.;;;;;;;;;x,,,,,,,,,,,,,,
employ_marshal;Invite Marshal to Court;Inviter un Maréchal à la Cour.;Marschall an den Hof laden;;Invite Marshal to Court;;;;;;;x;;;;,,,,,,,,,,,,,,
employ_marshal_desc;Invite a promising nobleman to court, to help train your armies.;Inviter un noble prometteur à la Cour, pour vous aider à entraisner vos hommes d'armes.;Laden Sie einen viel versprechenden Adligen in den Rat ein, um dabei zu helfen unsere Armee auszubilden.;;Invite a promising nobleman to court, to help train your armies.;;;;;;;x;;,,,,,,,,,,
employ_spymaster;Invite Spymaster to Court;Inviter un Maistre-Espion à la Cour;Hofspitzel an den Hof laden;;Invite Spymaster to Court;;;;;;;x;;,,,,,,,,,,,,,,
employ_spymaster_desc;Invite a promising nobleman to court, to help run your spy network.;Inviter un noble prometteur à la Cour, pour vous aider à diriger votre réseau d'espions.;Laden Sie einen Hofspitzel in den Rat ein der uns hilft ein Spitzelnetzwerk aufzubauen.;;Invite a promising nobleman to court, to help run your spy network.;;;;;;;x;;;;,,,,,,,,,,,
employ_steward;Invite Steward to Court;Inviter un Intendant à la Cour;Kämmerer an den Hof laden;;Invite Steward to Court;;;;;;;x;;,,,,,,,,,,,,,,
employ_steward_desc;Invite a promising nobleman to court, to aid with matters of administration.;Inviter un noble prometteur à la Cour, pour vous assister en matière d'administration.;Laden Sie einen viel versprechenden Adligen in den Rat ein, um in Regierungsangelegenheiten zu helfen.;;Invite a promising nobleman to court, to aid with matters of administration.;;;;;;;x;;;;,,,,,,,,,,
expelled_ansar;Expelled the Ansar;Confrérie des Bektachis expulsée;Den Orden der Bektaschi vertrieben;;Orden Ansar expulsada;;;;;;;;;x;;,,,,,,,,,,,,,,
expel_the_ansar;Expel the Ansar;Expulser la Confrérie des Bektachis;Vertreibt den Orden der Bektaschi;;Expulsar a la Orden Ansar;;;;;;;;;x;;,,,,,,,,,,,,,,
expel_the_ansar_desc;I can drive the Ansar from my realm and seize their castles. However, it is a very impious thing to do...;Je puis expulser la Confrérie des Bektachis de mon territoire et prendre possession de leurs castels. Ce seroit par contre un acte très impie...;Ich kann den Orden der Bektaschi aus meinem Reich vertreiben und mir ihre Burgen aneignen. Das ist jedoch eine sehr unfromme Tat...;;Puedo echar a la Orden Ansar de mi reino y apoderarme de sus castillos. Sin embargo, es una acción muy impía...;;;;;;;;;x,,,,,,,,,,,,
extend_finland;Claim Kola for Finland;Claim Kola for Finland;Claim Kola for Finland;;Claim Kola for Finland;;;;;;;;;x,,,,,,,,,,,,,,
extend_finland_desc;The tribal lands of Kola are rightfully part of Finland's de jure territory.;The tribal lands of Kola are rightfully part of Finland's de jure territory.;The tribal lands of Kola are rightfully part of Finland's de jure territory.;;The tribal lands of Kola are rightfully part of Finland's de jure territory.;;;;;;;;;x,,,,,,,,,,,,,,
feast_0;Plan a Feast;Organiser un banquet;Großes Fest planen;;Plan a Feast;;;;;;;;;x;;,,,,,,,,,,,,,,
feast_0_desc;In winter we shall hold the biggest feast ever seen in the realm!;En hiver nous allons organiser le plus grand banquet du royaume !;Im Winter sollten wir das größte Fest unseres Reiches veranstalten!;;In winter we shall hold the biggest feast ever seen in the realm!;;;;;;;;;x;;,,,,,,,,,,,,,,
feast_1;Plan a Feast;Organiser un banquet;Gelage abhalten;;Celebrar un banquete;;;;;;;;;x;;,,,,,,,,,,,,,,
feast_1_desc;In winter we shall hold the biggest feast ever seen in the Kingdom!;Organisez le plus grand banquet du royaume !;Veranstaltet das größte Gelage, das das Königreich je gesehen hat!;;¡Celebra el banquete más grande jamás visto en el reino!;;;;;;;;;x;;,,,,,,,,,,,,,
feast_2;Plan a Feast;Organiser un banquet;Gelage abhalten;;Celebrar un banquete;;;;;;;;;x;;,,,,,,,,,,,,,,
feast_2_desc;In winter we shall hold the biggest feast ever seen in the Kingdom!;Organisez le plus grand banquet du royaume !;Veranstaltet das größte Gelage, das das Königreich je gesehen hat!;;¡Celebra el banquete más grande jamás visto en el reino!;;;;;;;;;x;;,,,,,,,,,,,,,
fianna_organized;The Fianna is formed.;Les Fianna sont créés.;The Fianna is formed.;;The Fianna is formed.;;;;;;;;;x,,,,,,,,,,,,,,
gwydion_organized;The Gwydion is formed.;Le Gwydion est formé.;The Gwydion is formed.;;The Gwydion is formed.;;;;;;;;;x,,,,,,,,,,,,,,
give_to_charity;Give to Charity;Donner à la charité;Geben Sie Wohltätigkeit;;Give to Charity;;;;;;;;;x,,,,,,,,,,,,,,
give_to_charity_desc;Give a voluntary donation to [Root.Religion.GetName] charities.;Faites un don volontaire aulx oeuvres de charité de [Root.Religion.GetName].;Give a voluntary donation to [Root.Religion.GetName] charities.;;Give a voluntary donation to [Root.Religion.GetName] charities.;;;;;;;;;x;;,,,,,,,,,,,,,,
gone_pagan;Adopt the Old Ways;Adopter la Religion du pays;Adopt the Old Ways;;Adopt the Old Ways;;;;;;;;;x,,,,,,,,,,,,,,
gone_pagan_zoroastrian;Adopt the Old Ways;Adopter la Religion du pays;Adopt the Old Ways;;Adopt the Old Ways;;;;;;;;;x,,,,,,,,,,,,,,
gone_pagan_celtic_norse;Adopt the Old Ways;Adopter la Religion du pays;Adopt the Old Ways;;Adopt the Old Ways;;;;;;;;;x,,,,,,,,,,,,,,
gone_pagan_baltic_finnic;Adopt the Old Ways;Adopter la Religion du pays;Adopt the Old Ways;;Adopt the Old Ways;;;;;;;;;x,,,,,,,,,,,,,,
gone_pagan_tengri;Adopt the Old Ways;Adopter la Religion du pays;Adopt the Old Ways;;Adopt the Old Ways;;;;;;;;;x,,,,,,,,,,,,,,
gone_pagan_aztec;Adopt the Old Ways;Adopter la Religion du pays;Adopt the Old Ways;;Adopt the Old Ways;;;;;;;;;x,,,,,,,,,,,,,,
gone_pagan_slavic;Adopt the Old Ways;Adopter la Religion du pays;Adopt the Old Ways;;Adopt the Old Ways;;;;;;;;;x,,,,,,,,,,,,,,
gone_pagan_african;Adopt the Old Ways;Adopter la Religion du pays;Adopt the Old Ways;;Adopt the Old Ways;;;;;;;;;x,,,,,,,,,,,,,,
gone_pagan_egyptian;Adopt the Old Ways;Adopter la Religion du pays;Adopt the Old Ways;;Adopt the Old Ways;;;;;;;;;x,,,,,,,,,,,,,,
gone_pagan_judaic;Adopt the Old Ways;Adopter la Religion du pays;Adopt the Old Ways;;Adopt the Old Ways;;;;;;;;;x,,,,,,,,,,,,,,
gone_pagan_hellenic;Adopt the Old Ways;Adopter la Religion du pays;Adopt the Old Ways;;Adopt the Old Ways;;;;;;;;;x,,,,,,,,,,,,,,
