#CODE;ENGLISH;FRENCH;GERMAN;;SPANISH;;;;;;;;;x,,,,,,,,,,,,,,
restore_roman_empire_hre_desc;If Rome, Constantinople, and other key territories of the old empire could be reclaimed, the Holy Roman Empire would win recognition in the eyes of the East as the true and rightful successor of the Roman State.;Si Rome, Constantinople, et d'aultres territoires-clé du vieil empire pouvoient revenir sous notre controsle, le Saint Empire Romain seroit reconnu en orient comme le véritable et légitime successeur de l'Empire Romain.;If Rome, Constantinople, and other key territories of the old empire could be reclaimed, the Holy Roman Empire would win recognition in the eyes of the East as the true and rightful successor of the Roman State.;;If Rome, Constantinople, and other key territories of the old empire could be reclaimed, the Holy Roman Empire would win recognition in the eyes of the East as the true and rightful successor of the Roman State.;;;;;;;;;x,,
restore_the_pontifex;Restore the Pontifex Maximus;Restaurer le Pontifex Maximus;Restore the Pontifex Maximus;;Restore the Pontifex Maximus;;;;;;;;;x,,,,,,,,,,,,,,
restore_the_pontifex_desc;Restore the Pontifex Maximus;Restaurer le Pontifex Maximus;Restore the Pontifex Maximus;;Restore the Pontifex Maximus;;;;;;;;;x,,,,,,,,,,,,,,
sicily_regained;Sicily Regained;La Sicile Reconquise;Sicily Regained;;Sicily Regained;;;;;;;;;,,,,,,,,,,,,,,
sicily_regained_desc;Sicily has been re-conquered! It is time to ask the pope for my promised crown.;La Sicile a été reconquise ! Il est temps de demander au Pape d'honorer sa promesse de me couronner.;Sicily has been re-conquered! It is time to ask the pope for my promised crown.;;Sicily has been re-conquered! It is time to ask the pope for my promised crown.;;;;;;;;;,,,,,,,,,,,,,,
summer_fair_0;Plan a Summer Fair;Organiser un festival d'été;Jahrmarkt planen;;Plan a Summer Fair;;;;;;;;;x;;,,,,,,,,,,,,,,
summer_fair_0_desc;The Summer Fair brings merchants, peddlers and all sorts of entertainment to your province.;Le Festival dété est loccasion dattirer marchands, colporteurs et aultres divertissements dans votre province.;Im Sommer bringt ein Jahrmarkt Händler, Hausierer und alle Arten von Unterhaltung in unsere Provinz.;;The Summer Fair brings merchants, peddlers and all sorts of entertainment to your province.;;;;;;;;;x,,,,,,,,,,
summer_fair_1;Plan a Summer Fair;Organiser un Festival dété;Sommerfest abhalten;;Celebrar una feria de verano;;;;;;;;;x;;,,,,,,,,,,,,,,
summer_fair_1_desc;The Summer Fair brings merchants, peddlers and all sorts of entertainment to your province.;Le Festival dété est loccasion dattirer marchands, colporteurs et aultres divertissements dans votre province.;Das Sommerfest bringt Kaufleute, fahrende Händler und allerlei Unterhalter in Eure Provinz.;;La feria de verano atrae a mercaderes, vendedores ambulantes y todo tipo de entretenimiento a tu provincia.;;;;;;;;;x,,,,,,,,,,
summer_fair_2;Plan a Summer Fair;Organiser un Festival dété;Sommerfest abhalten;;Celebrar una feria de verano;;;;;;;;;x;;,,,,,,,,,,,,,,
summer_fair_2_desc;The Summer Fair brings merchants, peddlers and all sorts of entertainment to your province.;Le Festival dété est loccasion dattirer marchands, colporteurs et aultres divertissements dans votre province.;Das Sommerfest bringt Kaufleute, fahrende Händler und allerlei Unterhalter in Eure Provinz.;;La feria de verano atrae a mercaderes, vendedores ambulantes y todo tipo de entretenimiento a tu provincia.;;;;;;;;;x,,,,,,,,,,
TAILTEANNTITLE;Aonach Tailteann;Aonach Tailteann;Aonach Tailteann;;Aonach Tailteann;;;;;;;;;x;;,,,,,,,,,,,,,,
tailteann_invite;You send invitations to the Aonach;Vous envoyez des invitations à l'Aonach;You send invitations to the Aonach;;You send invitations to the Aonach;;;;;;;;;x,,,,,,,,,,,,,,
take_loan;Take a Loan;Emprunter;Kredit nehmen;;Take a Loan;;;;;;;;;x;;,,,,,,,,,,,,,,
take_loan_desc;Take a five-year loan at 25% interest;Contractez un emprunt sur cinq ans à un taulx dintérest de 25%.;Ein Fünfjahresdarlehen zu 25% Zinsen aufnehmen;;Coge un préstamo de cinco años al 25% de interés;;;;;;;;;x;;,,,,,,,,,,,,,,
vassalize_desc;You can force any de jure vassal to swear fealty to you.;Vous pouvez forcer n'importe quel vassal de jure à vous jurer fidélité.;Ihr könnt einen de jure Vasallen dazu erzwingen, Euch die Gefolgschaft zu schwören.;;You can force any de jure vassal to swear fealty to you.;;;;;;;x;;;;,,,,,,,,,,,,,
vassal_blinding_decision_persian;As [Root.GetSheHe] is your prisoner, you may give the order to permanently blind [Root.GetTitledFirstName] and then setting [Root.GetHerHim] free. This is a common Persian way of dealing with political rivals without outright killing them, as a blind [Root.GetManWoman] is of little threat to the throne;Comme [Root.GetSheHe] est votre prisonnier, vous pouvez donner l'ordre d'aveugler irrémédiablement [Root.GetTitledFirstName] puis de le (la) libérer. C'est une façon assez courante chez les Perses de s'occuper de rivaulx politiques sans aller jusqu'à les occire, comme un(e) [Root.GetManWoman] aveugle ne représente guère de danger pour le trosne;As [Root.GetSheHe] is your prisoner, you may give the order to permanently blind [Root.GetTitledFirstName] and then setting [Root.GetHerHim] free. This is a common Persian way of dealing with political rivals without outright killing them, as a blind [Root.GetManWoman] is of little threat to the throne;;As [Root.GetSheHe] is your prisoner, you may give the order to permanently blind [Root.GetTitledFirstName] and then setting [Root.GetHerHim] free. This is a common Persian way of dealing with political rivals without outright killing them, as a blind [Root.GetManWoman] is of little threat to the throne;;;;;;;;;x,,,,,,
create_kingdomofalbania;Create the Kingdom of Albania;FRENCH;GERMAN;;SPANISH;;;;;;;;;x
create_kingdomofalbania_desc;Create the Kingdom of Albania;FRENCH;GERMAN;;SPANISH;;;;;;;;;x
